ID,Fecha,Siglo,Provincia,Población,Cont_anterior,Forma,Cont_posterior,Variante,Ámbito,Latitud,Longitud
CODEA-1361,1490,XV,Burgos,Burgos,"o cualesquier persona o personas que vos las vengan demandando o embargando o contrariando todas o parte d'ellas, berbal o",actualmente,o en otra cualquier manera que sea e de tomar e que tomaré por vós y en vuestro nombre el,–mente,particular,42.3439925,-3.696906
CODEA-1361,1490,XV,Burgos,Burgos,cuanto me los vós distes e pagastes e los yo de vós recibí e pasaron del vuestro poder al mío,realmente,"e con efecto ant'el escrivano e testigos d'esta carta en ducados e doblas de oro e reales de plata, tantos",–mente,particular,42.3439925,-3.696906
CODEA-1361,1490,XV,Burgos,Burgos,aquesta ley e yo ansí la renuncio por cuanto conosco que recibí de vós todos los dichos maravedís bien e,complidamente,como dicho es. E otrosí renuncio todas las otras leyes e fueros e derechos que en contrario d'esta carta e,–mente,particular,42.3439925,-3.696906
CODEA-1361,1490,XV,Burgos,Burgos,el dicho bachiller fray Andrés de Horna o a quien por vós lo oviere de aver atán bien e atán,complidamente,de la dicha pena del doblo si en ella cayere como del dicho principal e de todas las costas e,–mente,particular,42.3439925,-3.696906
CODEA-1361,1490,XV,Burgos,Burgos,"de todas las costas e daños e menoscabos que sobre la dicha razón se vos recrecieren de todo, bien e",complidamente,"bien ansí como si los dichos alcaldes e juezes, e justicias o cualquier d'ellos ansí lo oviesen juzgado e sentenciado",–mente,particular,42.3439925,-3.696906
CODEA-1199,1491,XV,Sevilla,Sevilla,"nin labrar nin labren el dicho xabón, nin anchova e sardina anchovada en la dicha cibdad e su tierra, salvo",solamente,"los vecinos d'ella e de su tierra porque la dicha cibdad se pueble e ennoblesca, e los vecinos d'ella que",–mente,cancilleresco,37.3890924,-5.9844588
CODEA-1740,1491,XV,Guadalajara,Guadalajara,tiene nós la tenemos en amor de verdadera hermana y así querríamos fazer por ella y por sus cosas rogámosvos,afectuosamente,si servicio y plazer nos deseades fazer que en los tiempos del invierno dexedes e consintades pacer las dichas tres,–mente,eclesiástico,40.632489,-3.1601699
CODEA-1740,1491,XV,Guadalajara,Guadalajara,nos deseades fazer que en los tiempos del invierno dexedes e consintades pacer las dichas tres mill cabeças de ganado,libremente,por los baldíos d'esa nuestra villa e su tierra y lo repartades por los términos de la dicha nuestra villa,–mente,eclesiástico,40.632489,-3.1601699
CODEA-1885,1492,XV,Badajoz,Zafra,y fueren de aí adelante para siempre fagan dar de comer a siete o ocho pobres ombres y mujeres dolientes,continuamente,"dándoles camas limpias y dietas y manjares cuales ordenare el físico que toviere cargo de visitarlos. El cual físico, cuando",–mente,particular,38.4225303,-6.4157225
CODEA-1885,1492,XV,Badajoz,Zafra,"doña María de Toledo mi muger, y por nuestros decendientes, herederos y subcesores que después de nós venieren, se mande",perpetuamente,guardar lo aquí contenido. Por ende mando primeramente y es mi voluntad que el mayordomo del dicho ospital que es,–mente,particular,38.4225303,-6.4157225
CODEA-1885,1492,XV,Badajoz,Zafra,Los cuales todos dichos bienes y maravedís de censos y pan y renta he por bien y mando que queden,perpetuamente,"para todo siempre jamás aplicados por propios del dicho ospital. E que yo ni la dicha condesa mi muger, nin",–mente,particular,38.4225303,-6.4157225
CODEA-1885,1492,XV,Badajoz,Zafra,dicho. E para poder complirse todo lo sobre dicho los bienes que quedan aplicados al dicho ospital son los seguientes.,Primeramente,"la heredad del Rencón que los dichos señores conde y condesa mis padres, que ayan gloria, dieron la meitad, e",–mente,particular,38.4225303,-6.4157225
CODEA-1885,1492,XV,Badajoz,Zafra,"nuestros decendientes herederos y subcesores que después de nós venieren, se mande perpetuamente guardar lo aquí contenido. Por ende mando",primeramente,"y es mi voluntad que el mayordomo del dicho ospital que es agora Juan de Cuéllar, y los que después",–mente,particular,38.4225303,-6.4157225
CODEA-0682,1492,XV,Burgos,Burgos,los derechos y retos juizios <<>>fallamos que debemos mandar y mandamos sentenciar y sentenciamos en la manera y forma siguiente:,primeramente,que cada y cuando que algund perroquiano o feligreses de la dicha villa e iglesia eligere o se mandare sepultar,–mente,eclesiástico,42.3439925,-3.696906
CODEA-2498,1492,XV,Cuenca,Cuenca,Iglesia e protesto de los abjurar. Por ende con pura e verdadera contrición e voluntad limpia e agradable confisión pido,humelmente,ser absuelta de la sentencia de excomunión en que he estado ligada e incurrí por los dichos delictos e ser,–mente,judicial,40.0703925,-2.1374161
CODEA-2498,1492,XV,Cuenca,Cuenca,presente me acuerdo aver fecho e cometido e visto fa<z>er e cometer desde mi ni<ñ>ez fasta el día de oy.,Primeramente,digo mi culpa que ayuné el ayuno mayor de los judíos algunas vezes estando en casa de mi padre Juan,–mente,judicial,40.0703925,-2.1374161
CODEA-2498,1492,XV,Cuenca,Cuenca,mi culpa que comí estando en mortuorios e ayudé a llorar e cantar a modo de endechas en muchos mortuorios,especialmente,en muerte de mi marido e fijos e fijas. Iten purgué la carne e saqué la landrezilla de las piernas,–mente,judicial,40.0703925,-2.1374161
CODEA-2632,1492,XV,Lérida,Lérida,"que llamadas e oídas las partes, fagáis pesquisa e ayáis vuestra información por cuantas partes e maneras mejor e más",complidamente,pudiéredes saber la verdad así sobre lo del dicho lugar Fortuna cómo y de qué manera fue atributado al dicho,–mente,cancilleresco,41.6175899,0.62001459
CODEA-0299,1493,XV,Soria,Soria,fuesen leídas las dichas cartas de los dichos conservadores nin se impidiese la dicha paga pues fasta aquí avíades pagado,llanamente,mandando poner sobre ello grandes penas o proveerles cerca d'ello en otra manera como nuestra merced fuese segund que más,–mente,cancilleresco,41.765972,-2.4790305
CODEA-0299,1493,XV,Soria,Soria,contribuir en la contribuición de la dicha hermandad y en los otros pechos reales e concegiles e diz que agora,nuevamente,avéis intentado algunos de los pecheros del dicho lugar por vos subtraer e apartar de las dichas pecherías diz que,–mente,cancilleresco,41.765972,-2.4790305
CODEA-0299,1493,XV,Soria,Soria,mandando poner sobre ello grandes penas o proveerles cerca d'ello en otra manera como nuestra merced fuese segund que más,largamente,en su petición se contiene. La cual vista en la dicha junta fue acordado que devíamos mandar dar esta nuestra,–mente,cancilleresco,41.765972,-2.4790305
CODEA-0394,1494,XV,Valladolid,Medina del Campo,fiziere. E porque venga a noticia de todos e ninguno d'ello pueda pretender inorancia vos mandamos que lo fagades pregonar,públicamente,en las plaças e mercados e otros lugares acostumbrados d'esa dicha cibdad por pregonero e ante escrivano e fecho el,–mente,cancilleresco,41.3081627,-4.9154766
CODEA-1090,1494,XV,Valladolid,Medina del Campo,testigos e lo vi e oí así pasar e de pedimiento e mandamiento de su señoría este instrumento de testimonio,fielmente,fize escrivir e d'estos mis nombre e signo acostumbrados lo subsigné e corroboré en fee e testimonio de todo lo,–mente,eclesiástico,41.3081627,-4.9154766
CODEA-1090,1494,XV,Valladolid,Medina del Campo,de su señoría e rogava e rogó a los presentes que fuesen d'ello testigos. A lo cual fueron testigos presentes,especialmente,"rogados y rogados: el señor Diego de Santander heredero de su señoría e secretario de sus altezas, e el señor",–mente,eclesiástico,41.3081627,-4.9154766
CODEA-0932,1494,XV,Madrid,Madrid,por cuanto diz que ellos no deven los dichos maravedís ni otros maravedís algunos de las dichas rentas antes tienen,enteramente,pagados todos los maravedís que montó al dicho su cargo según están prestos de lo mostrar ante nós por nuestras,–mente,cancilleresco,40.4167754,-3.7037901
CODEA-0932,1494,XV,Madrid,Madrid,los dichos diez e seis mil e setecientos e veinte e cuatro maravedís según que esto e otras cosas más,largamente,"en la dicha nuestra carta se contiene. E agora por parte del dicho concejo justicia, regidores, cavalleros, escuderos, oficiales e",–mente,cancilleresco,40.4167754,-3.7037901
CODEA-2501,1494,XV,Guadalajara,Sigüenza,"fiscal dixeron que davan al dicho Juan Martínez en el dicho nombre término de nueve días, los cuales le dieron",perentoriamente,"para provar y aver provado. E después de lo susodicho en la villa de Molina, estando sus reverencias en su",–mente,judicial,41.069167,-2.639167
CODEA-2501,1494,XV,Guadalajara,Sigüenza,"no filava el sábado por devoción de Nuestra Señora la Virgen María pero que fazía otras faziendas de por casa,",mayormente,ante nosotros. Y que sabe que guardava otros días pero que no sabe si eran ayunos de judíos o no.,–mente,judicial,41.069167,-2.639167
CODEA-1276,1495,XV,Madrid,Madrid,mandado cada e cuando e a la persona o personas que sus altezas o la reina nuestra señora mandare e,finalmente,fará e complirá realmente e con efetto todas las otras cosas e cadaúna d'ellas que como bueno e leal alcaide,–mente,cancilleresco,40.4167754,-3.7037901
CODEA-1276,1495,XV,Madrid,Madrid,lo pudiere estorvar que fará saberlo a sus altezas lo más presto que pudiere por manera que su servicio sea,enteramente,guardado e non tomará nin ocupará sus rentas reales nin cosa alguna d'ellas nin de las rentas de la dicha,–mente,cancilleresco,40.4167754,-3.7037901
CODEA-1276,1495,XV,Madrid,Madrid,"señor comendador mayor de León cavallero e ome fijo d'algo, que <…> lo recebió, que terná e guardará leal e",fielmente,e con toda diligencia la dicha fortaleza de Fuentes e que acojerá en ella a sus altezas e a cadaúno,–mente,cancilleresco,40.4167754,-3.7037901
CODEA-1276,1495,XV,Madrid,Madrid,e a la persona o personas que sus altezas o la reina nuestra señora mandare e finalmente fará e complirá,realmente,e con efetto todas las otras cosas e cadaúna d'ellas que como bueno e leal alcaide es obligado de fazer,–mente,cancilleresco,40.4167754,-3.7037901
CODEA-0022,1496,XV,Valladolid,Valladolid,y exercer la dicha juridición cevil e criminal en el dicho término. E diz qu'el comendador de Avino tiene agora,nuevamente,fechas ciertas ventas e á puesto en ellas un bentero. E porque los arrendadores de las alcávalas de la dicha,–mente,cancilleresco,41.6294336,-4.2616986
CODEA-0022,1496,XV,Valladolid,Valladolid,les non deven entremetiéndose los dichos conserbadores a dar sus cartas muy agraviadas e inibiendo luego a vuestras justicias no,solamente,por lo que toca a sus bienes y diezmos de los tales monesterios e a los bienes de las órdenes,–mente,cancilleresco,41.6294336,-4.2616986
CODEA-1408,1496,XV,Burgos,Burgos,dicho monesterio que gela volvería. Y luego la dicha señora abadesa dixo que cierto ella no tenía la dicha Isabel,forçadamente,nin Dios lo quisiese antes ella era venida al dicho monesterio diziendo que su voluntad avía buen tiempo era de,–mente,eclesiástico,42.3439925,-3.696906
CODEA-1408,1496,XV,Burgos,Burgos,dichos guardián e religiosos dixo a la dicha Isabel la relación qu'el dicho fiscal le avía hecho y para que,enteramente,sopiese la verdad d'ella se quería informar y que le rogavan que en ella enteramente dixese su intención de lo,–mente,eclesiástico,42.3439925,-3.696906
CODEA-1408,1496,XV,Burgos,Burgos,"avía hecho y para que enteramente sopiese la verdad d'ella se quería informar, y que le rogavan que en ella",enteramente,"dixese su intención de lo que era su voluntad si era de ser religiosa o casada, o de qué manera",–mente,eclesiástico,42.3439925,-3.696906
CODEA-1408,1496,XV,Burgos,Burgos,avía seído el sacramento del matrimonio e que tan bien se salvaría en él como en religión. E porque más,enteramente,y mejor respondiese a todo lo susodicho mandava a mí el dicho notario tomase e reciviese juramento de la dicha,–mente,eclesiástico,42.3439925,-3.696906
CODEA-2571,1496,XV,Guadalajara,Molina de Aragón,y confesado si los dezía como endechas y por judaizar como los judíos lo hazen; dixo que no. Fue preguntada,especificadamente,por todos los otros ritos de la ley de Moisén y si avrá fecho otros algunos; dixo que no ha,–mente,judicial,40.346674,-1.8850569
CODEA-2571,1496,XV,Guadalajara,Molina de Aragón,santa fee católica en observancia de la ley de Moisén y que si ansí lo hiziese nos avríamos con ella,piadosamente,y la recibiríamos a reconciliación de la santa madre Iglesia y la absolveríamos de la excomunión en que avía incurrido,–mente,judicial,40.346674,-1.8850569
CODEA-2571,1496,XV,Guadalajara,Molina de Aragón,"confesado tiene y que quiere bevir y morir en la santa fee católica, si ansí es, que no fengida ni",simuladamente,viene y se convierte absolvémosla de la dicha sentencia de excomunión en que incurrió y restituímosla a la unión y,–mente,judicial,40.346674,-1.8850569
CODEA-2571,1496,XV,Guadalajara,Molina de Aragón,año sus reverencias mandaron sacar ante sí a la dicha Juana Fernández y traída le dixieron y amonestaron que diga,enteramente,la verdad de sí y de otros más que sabe. Y luego la dicha dixo que sabe y se le,–mente,judicial,40.346674,-1.8850569
CODEA-2571,1496,XV,Guadalajara,Molina de Aragón,"Juana Ferrández y cómo la mandamos prender, y traída a nuestra cárcel fue por nós amonestada que dixese y confesase",enteramente,la verdad de lo que avía fecho y cometido contra nuestra santa fee católica en observancia de la ley de,–mente,judicial,40.346674,-1.8850569
CODEA-2571,1496,XV,Guadalajara,Molina de Aragón,fasta la noche y que lo tenían ya por uso cada año como feria en aquella villa y que esto,públicamente,pasava que non se les dava nada y que las que bebían en el Castil de Judíos venían cada sábado,–mente,judicial,40.346674,-1.8850569
CODEA-2571,1496,XV,Guadalajara,Molina de Aragón,"comunión de los fieles y católicos cristianos y que quiere abjurar renuciar y detestar toda especie de heregía y apostasía,",especialmente,"esta de los judíos que confesado tiene y que quiere bevir y morir en la santa fee católica, si ansí",–mente,judicial,40.346674,-1.8850569
CODEA-2571,1496,XV,Guadalajara,Molina de Aragón,"su avdiencia los reverendos señores el licenciado Fernando de Villa y el bachiller Juan de Centenera inquisidores, e estando ansimesmo",juntamente,"con sus reverencias los reverendos señores el doctor Juan Álvarez provisor, y el <…> de Paniza y el licenciado de",–mente,judicial,40.346674,-1.8850569
CODEA-2571,1496,XV,Guadalajara,Molina de Aragón,ante nós fizo como por la provança de testigos que contra ella avía el dicho promotor fiscal provó bien y,complidamente,"su entención y que por bien provada la devemos pronuciar y pronuciamos, y declaramos la dicha Juana Ferrández ser y",–mente,judicial,40.346674,-1.8850569
CODEA-0832,1496,XV,Zaragoza,Calatayud,"dineros jaqueses buena moneda, corrible en el regno de Aragón; los cuales atorgo aver ovido e contantes en poder mío",realmente,"de fecho recebido ensemble con el aliara siquiere robradura renunciant a toda excepción de frau e de engaño, e a",–mente,particular,41.3531678,-1.6468455
CODEA-2633,1496,XV,Tarragona,Tortosa,que ovieren menester por sus dineros segund que entre vosotros valieren sin gelos más encarecer e los tratedes bien e,humanamente,e que si oviere de presentar el dicho <ju>bileo salgáis e fagáis salir a los vezinos d'esas cibdades e villas,–mente,cancilleresco,40.8125,0.521111
CODEA-0315,1497,XV,Palencia,"Santa María de Aguilar de Campoo, Aguilar de Campoo",préstamos sobredichos vos damos e confirmamos para vós e para vuestros herederos e para los que de vós venieren e,legítimamente,"sucedieren e en el dicho lugar moraren para que seades e sean nuestros vasallos solariegos de fuero e desafuero, segund",–mente,particular,42.795889,-4.271836
CODEA-0315,1497,XV,Palencia,"Santa María de Aguilar de Campoo, Aguilar de Campoo","solar moraren e an morado <…> que siempre lo tenga un heredero y no más, el que de vosotros decendiere",legítimamente,como dicho es e que more en el dicho solar. E que non seades ni sean poderosos vós ni los,–mente,particular,42.795889,-4.271836
CODEA-0479,1498,XV,Cantabria,San Vicente de la Barquera,e otra del monesterio de Sant Mamés de Vilbao e de Içaro de Bermeo e llebar en ellas libre e,desembargadamente,para las dichas casas e monesterios e frailes d'ellos todas las cosas que fueren necesarias para su proveimiento e mantenimiento,–mente,cancilleresco,43.3813069,-4.397058
CODEA-0479,1498,XV,Cantabria,San Vicente de la Barquera,vestias llevaren para las necesidades de su probeimiento e mantenimiento de los dichos fraires e les dexedes e consintades andar,libremente,por todos los puertos d'estos nuestros reinos con sus vestias; e dexedes andar una varca del monesterio de Sant Vicente,–mente,cancilleresco,43.3813069,-4.397058
CODEA-0479,1498,XV,Cantabria,San Vicente de la Barquera,Este es traslado sacado bien e,fielmente,de un previllejo oreginal del rey e reina nuestros señores escrito en pargamino de cuero e firmado de sus nombres,–mente,cancilleresco,43.3813069,-4.397058
CODEA-1091,1498,XV,Valladolid,Valladolid,seyendo como es de vuestra reverendísima señoría suplícole que aya por bueno que la justicia d'esto se vea y determine,brevemente,mandando nombrar vuestra señoría un letrado en esta villa cual quisiere y fuere su servicio e yo nombraré otro ante,–mente,eclesiástico,41.6294336,-4.2616986
CODEA-1091,1498,XV,Valladolid,Valladolid,"dezir que no librase mi provisor por lo cual y por no dar enojo a vuestra señoría nin le deservir,",mayormente,"en tiempo que tanto á menester descanso y plazer les torné a escrivir una carta, el traslado de la cual",–mente,eclesiástico,41.6294336,-4.2616986
CODEA-1091,1498,XV,Valladolid,Valladolid,"villa e los míos para que vistos vean e determinen la justicia, que cierto después que tengo este obispado y",mayormente,después que aquí estoy de asiento é seído asaz culpado de algunos porque dexo perder la jurisdición d'ella y de,–mente,eclesiástico,41.6294336,-4.2616986
CODEA-1091,1498,XV,Valladolid,Valladolid,provisor e cabillo d'esta su iglesia de Valladolid que teniendo ellos esención de mi jurisdición ordinaria se á atentado agora,nuevamente,de poner en ella provisores que conoscan de las cabsas de mis súbditos no podiéndolo hazer estando yo ausente d'esta,–mente,eclesiástico,41.6294336,-4.2616986
CODEA-1091,1498,XV,Valladolid,Valladolid,entremetieron a conocer de prima instancia de cabsa que tocase a persona alguna d'esta villa nin de su abadía sino,solamente,de las cabsas de mi obispado es grand razón que la justicia d'esto se vea y determine si a vuestra,–mente,eclesiástico,41.6294336,-4.2616986
CODEA-1091,1498,XV,Valladolid,Valladolid,"si no es esenta pues está en mi obispado, nin menos me plaze ir contra su esención si la tiene",especialmente,seyendo como es de vuestra reverendísima señoría suplícole que aya por bueno que la justicia d'esto se vea y determine,–mente,eclesiástico,41.6294336,-4.2616986
CODEA-1294,1498,XV,Valladolid,Valladolid,para que estando vós al servicio d'esta muy noble villa de Valladolid vos asentéis en ella a oír e librar,públicamente,los pleitos que ante vós venieren en la dicha villa de Valladolid e no en otra parte de todo el,–mente,eclesiástico,41.6294336,-4.2616986
CODEA-0449,1499,XV,Salamanca,Salamanca,que con el que traxere la carta el abad escriva cómo recibió la carta. Otrosí que ambos los dichos cabildos,generalmente,e particular en presencia e en absencia nos honremos los unos a los otros e nos ayudemos e favorescamos en,–mente,eclesiástico,40.9701039,-5.6635397
CODEA-0449,1499,XV,Salamanca,Salamanca,a Santa María e a las palabras de los Santos Evangelios e a la señal de la cruz en que,corporalmente,ponemos nuestras manos derechas e a las santas órdenes que recebimos que agora e para siempre ternemos guardaremos toda la,–mente,eclesiástico,40.9701039,-5.6635397
CODEA-0449,1499,XV,Salamanca,Salamanca,Espíritu Santo para en execución de todo lo susodicho ordenamos una santa hermandad que contiene en sí los capítulos siguientes:,Primeramente,que de aquí adelante e para siempre jamás nós ambos los dichos cabildos seamos juntos e hermanos así en lo,–mente,eclesiástico,40.9701039,-5.6635397
CODEA-0284,1499,XV,Granada,Granada,cabsa se amenguan los cavalleros que en nuestros reinos solía aver. E porque si a esto se diera lugar muy,prestamente,se perdieran en nuestros reinos la nobleza de la cavallería e se olvidara el exercicio militar de que en los,–mente,cancilleresco,37.1773363,-3.598557
CODEA-0284,1499,XV,Granada,Granada,un ombre armado e pelear cuando fuere menester pero que los ombres d'armas que andan o andovieren en nuestras guardas,continuamente,"con sus armas e cavallo que puedan traer allende del dicho cavallo un trotón o haca, o hacanea en que",–mente,cancilleresco,37.1773363,-3.598557
CODEA-0284,1499,XV,Granada,Granada,E por que lo susodicho sea notorio e ninguno d'ello pueda pretender inorancia mandamos que esta nuestra carta sea pregonada,públicamente,"por las plaças e mercados e otros lugares acostumbrados d'esta nuestra corte e d'esas dichas cibdades, e villas e lugares",–mente,cancilleresco,37.1773363,-3.598557
CODEA-0284,1499,XV,Granada,Granada,e mandamos que ninguno non cavalgase a mula sin tener cavallo con ciertas condiciones y en cierta manera segund más,largamente,en las cartas que sobre esto mandamos dar se contiene. E porque por espiriencia á parecido que esto non aprovecha,–mente,cancilleresco,37.1773363,-3.598557
CODEA-0284,1499,XV,Granada,Granada,"reinos e de nuestros súbditos e naturales d'ellos segund que lo remediaron reyes pasados de gloriosa memoria nuestros progenitores, e",especialmente,"el rey don Alonso nuestro quinto abuelo, en las cortes que hizo en Alcalá en la era de mil e",–mente,cancilleresco,37.1773363,-3.598557
CODEA-0460,1500,XVI,León,Vega de Espinareda,con todas las cosas que al dicho nuestro monasterio pertenecen y pertenecer deven en la dicha Agoera y segund más,largamente,"lo tuvo y poseyó Alvaro Gómez clérigo, e después Lope Álvarez de Agoera, e después Juan Márquez e María López",–mente,eclesiástico,42.7215806,-6.656295
CODEA-0729,1500,XVI,Cantabria,Monasterio de Santo Toribio de Liébana,"lo susodicho a censo perpetuo a vós el dicho Toribio de Narganes nuestro vasallo, para que lo ayades e tengades",perpetuamente,para siempre jamás para vós e para vuestros sucesores y herederos e después de vós lo ovieren de aver e,–mente,eclesiástico,43.150333,-4.654339
CODEA-0729,1500,XVI,Cantabria,Monasterio de Santo Toribio de Liébana,e hurción en cadaún año para siempre jamás al dicho monesterio y al prior e monjes que en él estovieren,perpetuamente,cinco fanegas de trigo con la fanega que hizo de merced e limosna al cuerpo santo para su iluminaria el,–mente,eclesiástico,43.150333,-4.654339
CODEA-0729,1500,XVI,Cantabria,Monasterio de Santo Toribio de Liébana,"comprastes que á por linderos el camino que va a la iglesia, y <…> parte vaxo el río, segund más",largamente,"está limitado e declarado en su logar. El cual dicho solar e huerto, e tierras e prados suso limitados con",–mente,eclesiástico,43.150333,-4.654339
CODEA-0729,1500,XVI,Cantabria,Monasterio de Santo Toribio de Liébana,"heredades prados que ovistes vendido en Castrejón, e en Traspeña, la cual emienda es la que vós distes la seguiente:",primeramente,un prado que es a do dicen cabe el molino que á por linderos de como Román la Huente y,–mente,eclesiástico,43.150333,-4.654339
CODEA-1389,1500,XVI,Segovia,s.l.,"fue y es un testigo solo e singular e segund derecho dicho de uno es avido por dicho de nenguno,",mayormente,"aviendo mandado como la dicha Mencía de Ribera mandó, que si la dicha su hija, muger del dicho Bernal de",–mente,judicial,40.94943,-4.119209
CODEA-1389,1500,XVI,Segovia,s.l.,"impedir la provança de testigos por el dicho Bernal de Medina parte contraria, tentada a fazer así por lo que",generalmente,dar e alegar se suele en semejantes contradiciones de testigos que digo e alego en particular contra los dichos e,–mente,judicial,40.94943,-4.119209
CODEA-1389,1500,XVI,Segovia,s.l.,el proceso del dicho pleito contenidas fallarán los dichos mis partes e yo en su nombre aver provado bien e,cumplidamente,sus excepciones e defensiones e tanto cuanto les convenía e conviene para ser deudos por libres e quitos de la,–mente,judicial,40.94943,-4.119209
CODEA-1389,1500,XVI,Segovia,s.l.,dichos bienes que demanda e pide e si algún testigo algo depuso o dixo en su favor sería e fue,solamente,Alonso Mellado e aquel dize que acudían con la mitad de la renta del majuelo al dicho parte adversa e,–mente,judicial,40.94943,-4.119209
CODEA-0378,1500,XVI,Toledo,Toledo,"oy dicho día al dicho ospital para las tres oras después de medio día. Prior Andrés d'Escalona portero d'esta cibdad,",especialmente,para otorgar lo que deyuso será contenido segund pareció por fe del dicho Andrés d'Escalona escrito de su letra e,–mente,municipal,39.8628316,-4.0273231
CODEA-1415,1500,XVI,Granada,Granada,conversión non sean libres y esentos de la obligación que por el dicho asiento e capitulación tiene fecha para traer,libremente,los cabtivos que durante el dicho levantamiento pasaron allende salvo que sean tenudos e obligados a los traer e restituir,–mente,cancilleresco,37.1773363,-3.598557
