ID,Fecha,Siglo,Provincia,Población,Cont_anterior,Forma,Cont_posterior,Variante,Ámbito,Latitud,Longitud
CODEA-0350,1569,XVI,Valladolid,Valbuena de Duero,presidente e oidores fue mandado dar traslado a la parte del dicho monesterio y el dicho Bernardino Gonçález alegando más,cumplidamente,del derecho de su parte presentó ante los dichos nuestro presidente e oidores otra petición en que dixo que nós,–mente,cancilleresco,41.6425,-4.291111
CODEA-0350,1569,XVI,Valladolid,Valbuena de Duero,de denegar y denegaran y condenaran en costas a los dichos sus partes según que en el dicho auto más,largamente,se contenía el cual dixo ninguno injusto y muy agraviado y de revocar por todas las razones de nulidad e,–mente,cancilleresco,41.6425,-4.291111
CODEA-0350,1569,XVI,Valladolid,Valbuena de Duero,"audiencia por el cual denegaran a sus partes lo que pidieran cerca de la declaración de la sentencia, según más",largamente,en el dicho auto se contenía cuyo tenor allí habido por inserto dixo que se devía mandar revocar por lo,–mente,cancilleresco,41.6425,-4.291111
CODEA-0350,1569,XVI,Valladolid,Valbuena de Duero,las partes contrarias tienen en el término de la dicha villa no se podía ni puede estender a más de,solamente,"las dichas viñas y porque las partes contrarias presentaran el dicho censo su pedimiento se había de estender conforme él,",–mente,cancilleresco,41.6425,-4.291111
CODEA-0350,1569,XVI,Valladolid,Valbuena de Duero,"Juan Redondo regidor de la dicha villa de Balbuena, e a Pero Ortega, procurador general del dicho <…>, estando presentes",juntamente,con ellos allegados más de veinte vecinos de la dicha villa de lo cual doy fe entre los cuales estavan,–mente,cancilleresco,41.6425,-4.291111
CODEA-1099,1569,XVI,Granada,Granada,"alojados largos assí en esta ciudad como en la Vega, como quiera que don Francisco de Solís haga su oficio",justamente,"y con la legalidad que debe y esto afirmo assí a vuestra magestad, todavía no puede acudir ni cumplir con",–mente,particular,37.1773363,-3.598557
CODEA-1099,1569,XVI,Granada,Granada,cómo está lo de Baça y Río de Almançora. Y porque sobre este particular tengo ya escrito a vuestra magestad,largamente,"no tengo más que dezir sino suplicar lo mande resolver con la brevedad que el negocio requiere, y considerar la",–mente,particular,37.1773363,-3.598557
CODEA-1100,1569,XVI,Granada,Granada,es servido que pase de la tasa antigua que á muchos años que se puso en estos reinos y conociendo,claramente,qu'es imposible que los capitanes oficiales ni soldados se puedan sustentar aviéndose mudado tanto los trajes y encarecido los precios,–mente,particular,37.1773363,-3.598557
CODEA-1100,1569,XVI,Granada,Granada,consideración en este caso y hacer nueva introdución sería dañoso a la hazienda de vuestra magestad todavía sí vemos aquí,claramente,que después que an cessado las raciones del Albaizín fue necessario permitir que por algunos días se diesen cuarenta maravedís,–mente,particular,37.1773363,-3.598557
CODEA-1100,1569,XVI,Granada,Granada,"los capitanes y oficiales y soldados tengan el sueldo antiguo de España, del cual se me embió ya relación, y",juntamente,con esto me escrivió la dicha ciudad lo que vuestra magestad podrá mandar ver por la copia de su carta,–mente,particular,37.1773363,-3.598557
CODEA-1296,1569,XVI,Granada,s.l.,vuestra magestad presente y aviéndole Dios dado tan claro juizio y tan gran entendimiento como le á dado entenderá muy,diferentemente,las cosas d'él que estando ausente puede entendellas por relación de personas que no las entienden y an puesto el,–mente,particular,37.17649,-3.597929
CODEA-1296,1569,XVI,Granada,s.l.,sea servido que tenga buen sucesso por muy costosa y de mucha dilación al señor don Juan é advertido muy,particularmente,de todo lo que en esta carta é apuntado para que ponga remedio en ello y á me respondido que,–mente,particular,37.17649,-3.597929
CODEA-1296,1569,XVI,Granada,s.l.,"tan larga suspensión de armas suceda esto y que vamos siempre perdiendo, porque es muy ordinario el perder los que",solamente,atienden a la defensa y cosa muy sabida y entendida lo que se gana en acometer a estos moros; y,–mente,particular,37.17649,-3.597929
CODEA-1296,1569,XVI,Granada,s.l.,en las Alpuxarras. El juntarse aora los campos del marqués de los Vélez y don Juan servirá a mi parecer,solamente,para su siguridad porque para acabar los enemigos y abreviar la guerra ningún consejo se puede tomar peor a mi,–mente,particular,37.17649,-3.597929
CODEA-1748,1569,XVI,Madrid,Alcalá de Henares,Este es un traslado bien e,fielmente,sacado de una probisión e reducción de misas de la memoria que el ilustre señor don Carlos de Mendoca deán,–mente,eclesiástico,40.4819791,-3.3635421
CODEA-1748,1569,XVI,Madrid,Alcalá de Henares,está obligado y le caben de dezir más de docientas y treinta missas en cadaún año y que para ello,solamente,tiene cinco mil maravedís y un cahíz de trigo y ciertas gallinas que todo les viene a valer y rentar,–mente,eclesiástico,40.4819791,-3.3635421
CODEA-1748,1569,XVI,Madrid,Alcalá de Henares,a dezir vós los dichos ocho capellanes conforme a la voluntad del dicho instituidor a que de aquí adelante digáis,solamente,tres misas en cadaún día en los días y de la devoción y según que por el dicho instituidor fue,–mente,eclesiástico,40.4819791,-3.3635421
CODEA-0031,1569,XVI,Guadalajara,Marchamalo,nombrado por soldado para los infantes que para esta ciudad se embían en servicio de su Magestad en lo cual,notoriamente,"los sussodichos me han agraviado porque los dichos oficiales por ser sus deudos y parientes, y para reserbarse a ellos,",–mente,particular,40.6678056,-3.2018198
CODEA-0176,1569,XVI,Guadalajara,Guadalajara,compelan e apremien a lo ansí cumplir por todo rigor de derecho y xecución d'él luego bien ansí e atán,cumplidamente,como si por sentencia difinitiva a ello fuésemos condenados e por nós consentida y pasada en cosa juzgada. Sobre lo,–mente,particular,40.632489,-3.1601699
CODEA-0176,1569,XVI,Guadalajara,Guadalajara,escrito y por palabra e plazo e consejo de abogado e la ley del dolo e del mal engaño; y,especialmente,renunciamos la ley o derecho en que diz que general renunciación de leyes fecha que non vala. En firmeza de,–mente,particular,40.632489,-3.1601699
CODEA-1762,1569,XVI,Guadalajara,Guadalajara,que a la suso dicha se siguieren e recrecieren con el dicho doblo y la pena pagada o no o,graciosamente,"remitida para lo cual ansí tener, e guardar, y cumplir y pagar obligo su persona e bienes muebles e raízes,",–mente,particular,40.632489,-3.1601699
CODEA-1762,1569,XVI,Guadalajara,Guadalajara,y la dotrinéis. Y me obligo que la dicha mi hija os servirá en todo el dicho tiempo bien e,fielmente,e no se ausentará so pena que si se ausentare pierda lo servido e torne a servir de nuevo al,–mente,particular,40.632489,-3.1601699
CODEA-1762,1569,XVI,Guadalajara,Guadalajara,"palabra e la ley del dolo e del mal engaño, e alvedrío de buen varón, e beneficio de restitución y",especialmente,renuciamos la ley o derecho en que diz que general renucia de leyes fecha que non va en firmeza de,–mente,particular,40.632489,-3.1601699
CODEA-1763,1569,XVI,Guadalajara,Guadalajara,"escrito y por palabra e plazo e consejo de abogado, e la ley del dolo e del mal engaño, y",expresamente,renunciamos la ley o derecho en que diz que general renuciación de leyes fecha que non vala; en firmeza de,–mente,particular,40.632489,-3.1601699
CODEA-1763,1569,XVI,Guadalajara,Guadalajara,compelan e apremien a lo ansí cumplir por todo rigor de derecho y execución d'él luego bien ansí e atán,cumplidamente,como si por sentencia difinitiva a ello fuésemos condenados e por nós consentida y pasada en cosa juzgada sobre lo,–mente,particular,40.632489,-3.1601699
CODEA-3201,1570,XVI,Asturias,Oviedo,"mayores y mejores que en otra parte aunque no ay muchas, es del corregidor d'este principado, pero tiénela limitada, que",solamente,conoce en grado de apelación o estando él presente en el dicho valle y no de otra manera. Y por,–mente,particular,43.36026,-5.844759
CODEA-3201,1570,XVI,Asturias,Oviedo,estas se echasen a cavallos de casta no saldría cría grande para lo que se pretende hazia las montañas. Y,especialmente,en el valle que dicen de Burón y los Argüelles y Bavia ay muchas yeguas grandes y tan buenas como,–mente,particular,43.36026,-5.844759
CODEA-0373,1570,XVI,Valladolid,s.l.,en menosprecio de nuestra real justicia habían tomado la vara al dicho alcalde mayor puesto por los dichos sus partes,injuriosamente,e nos pidiera que mandásemos imbiar una persona e castigase a los culpados. E porque a la sazón no se,–mente,cancilleresco,41.65295,-4.728388
CODEA-0373,1570,XVI,Valladolid,s.l.,se dezía Domingo e mandó por parte del dicho abad a ciertas presonas so ciertas penas que pareciesen ante el,presonalmente,segund parecía por un mandamiento que ante nós presentaban e porque los dichos alcaldes e vezinos del dicho lugar diz,–mente,cancilleresco,41.65295,-4.728388
CODEA-0373,1570,XVI,Valladolid,s.l.,antes que a otras personas todo lo que los dichos partes contrarias en esta parte dezían lo dezían maliciosamente e,falsamente,e solamente son cuatro o cinco hombres que con mucha malicia se an puesto en ello e an traído a,–mente,cancilleresco,41.65295,-4.728388
CODEA-0373,1570,XVI,Valladolid,s.l.,"muchos criados e moços, e collados e presonas que lo puedan hazer, e les apremian sobre ello que lo hagan",forçosamente,no abiendo cabsa nin razón alguna para lo hazer; e que ansí mismo el dicho abad haze a sus granjeros,–mente,cancilleresco,41.65295,-4.728388
CODEA-0373,1570,XVI,Valladolid,s.l.,vezinos de la dicha villa de Valbuena e no lo contradiziendo. E agora algunos de las vezinos del dicho concejo,maliciosamente,por se poner contra el dicho monesterio prendaron el ganado de los dichos granjeros los cuales a esta cabsa se,–mente,cancilleresco,41.65295,-4.728388
CODEA-0373,1570,XVI,Valladolid,s.l.,e mantener antes que a otras personas todo lo que los dichos partes contrarias en esta parte dezían lo dezían,maliciosamente,e falsamente e solamente son cuatro o cinco hombres que con mucha malicia se an puesto en ello e an,–mente,cancilleresco,41.65295,-4.728388
CODEA-0373,1570,XVI,Valladolid,s.l.,seído en el dicho concierto para saber por qué razón e causa habían hecho la dicha innobación de lo que,antiguamente,"se había usado e guardado e porque los dichos sus vasallos dixieron con mucha soberbia muchas palabras descorteses, e aún",–mente,cancilleresco,41.65295,-4.728388
CODEA-0373,1570,XVI,Valladolid,s.l.,granjeros que allí ponen e han puesto los sus predecesores de los dichos años e tiempo inmemorial a esta parte,continuamente,e porque no se pueden bien sostener toman ganado a renta de más de lo suyo propio e pacen con,–mente,cancilleresco,41.65295,-4.728388
CODEA-0373,1570,XVI,Valladolid,s.l.,e dixierom públicamente que no lo complirían nin harían cosa de lo que el dicho abad mandase e ansí muy,justamente,"les pudieron llebar las dichas penas e si nós diésemos lugar a que non los castigase e penase, ellos harían",–mente,cancilleresco,41.65295,-4.728388
CODEA-0373,1570,XVI,Valladolid,s.l.,tanto que estando presos hizieron bolber e tornar el dicho ganado que habían prendado a quien el dicho abad mandó,libremente,lo cual puede haber quinze días poco más o menos e no los quisieron dar la dicha carta de seguro,–mente,cancilleresco,41.65295,-4.728388
CODEA-0373,1570,XVI,Valladolid,s.l.,notificado el dicho mandamiento para que pareciesen ante él no lo quisieron hazer antes se pusieron en rebeldía e dixierom,públicamente,que no lo complirían nin harían cosa de lo que el dicho abad mandase e ansí muy justamente les pudieron,–mente,cancilleresco,41.65295,-4.728388
CODEA-0373,1570,XVI,Valladolid,s.l.,probeyésemos de remedio con justicia mandándolos desagraviar de las cosas susodichas e declaradas segund que esto y otras cosas más,largamente,en la dicha su petición se contenía; sobre lo cual hobimos mandado dar una nuestra carta para el dicho abad,–mente,cancilleresco,41.65295,-4.728388
CODEA-0373,1570,XVI,Valladolid,s.l.,"a otras personas todo lo que los dichos partes contrarias en esta parte dezían lo dezían maliciosamente e falsamente, e",solamente,son cuatro o cinco hombres que con mucha malicia se an puesto en ello e an traído a los otros,–mente,cancilleresco,41.65295,-4.728388
CODEA-0373,1570,XVI,Valladolid,s.l.,carta executoria parece que fue presentada ante los dichos nuestro presidente e oidores por parte del dicho concejo de Balbuena,juntamente,con otros autos y escrituras para en prueba de su intención su tenor de la cual dicha carta executoria con,–mente,cancilleresco,41.65295,-4.728388
CODEA-2975,1570,XVI,Albacete,Albacete,darles otras algunas ocassiones de que se puedan justamente quexar o dezir que no se guarda ni cumple lo tan,encarecidamente,por su alteza mandado que en'llo su magestad será servido donde no a los que lo contrario hizieren se les,–mente,municipal,38.99765,-1.86007
CODEA-2975,1570,XVI,Albacete,Albacete,los suyos propios ni entrar en sus casas contra su voluntad ni darles otras algunas ocassiones de que se puedan,justamente,quexar o dezir que no se guarda ni cumple lo tan encarecidamente por su alteza mandado que en'llo su magestad,–mente,municipal,38.99765,-1.86007
CODEA-3606,1571,XVI,Cáceres,Monroy,presente. E los bienes que el dicho Francisco de Monterruvio dixo tener del dicho Gaspar de Ribera son los siguientes:,primeramente,"unas casas principales que están en la dehesa de la Umbría que es en término de la cibdad de Trugillo,",–mente,particular,39.6361863,-6.2103887
CODEA-3607,1571,XVI,Badajoz,Villagarcía de la Torre,y hizo enventario de los bienes que los susodichos difuntos dexaron. El cual inventario se hizo en la forma siguiente:,primeramente,"unas casas de su morada que son en esta villa, linde con casas d'Estacio Valle; un solar para pajar en",–mente,particular,38.292934,-6.079112
CODEA-3607,1571,XVI,Badajoz,Villagarcía de la Torre,"duque mi señor, a do dizen El Cotorrillo, linde con tierras que trae Cristóval Candalixa y otros linderos. Bienes muebles:",primeramente,"seis yeguas de trilla y la una, parida con una potrita; más cuatro buyes de arada; más dos vacas de",–mente,particular,38.292934,-6.079112
CODEA-2980,1571,XVI,Toledo,Yepes,"no ba aquí inserta de la cual yo, el presente escribano, la hize que sus mercedes la tienen y queda",oreginalmente,en mi poder y hacemos saber al ilustre señor don Antonio de Luna vezino y regidor de dicha ciudad de,–mente,particular,39.9,-3.628889
CODEA-0032,1571,XVI,Granada,Granada,"puerta y siendo abierto, se cercará de gente alderredor echando fuera algunos cavallos que anden más lejos rodeando el lugar,",principalmente,por aquellos pasos por donde se imaginare que pueden bolver a la sierra para que todos estén tomados de manera,–mente,cancilleresco,37.1773363,-3.598557
CODEA-0032,1571,XVI,Granada,Granada,sobr'ello se han publicado. Procúrese que fuere posible de no entrar a comer ni fazer noche en lugares grandes porque,ordinariamente,se asconden y hurtan allí muchos moriscos y se les hazen muchos agravios y subceden inconvinientes que para averiguarlos y,–mente,cancilleresco,37.1773363,-3.598557
CODEA-0032,1571,XVI,Granada,Granada,la misma diligencia se hará en cualquier lugar en que por el camino subcediere caer alguno enfermo de manera que,claramente,se entienda que no puede passar adelante. También sería posible que algunos de los moriscos que aí se recogieren o,–mente,cancilleresco,37.1773363,-3.598557
CODEA-0032,1571,XVI,Granada,Granada,movido a hazer d'ellos esta mudança. Háseles de permitir que en las casas o iglesias donde estuvieren encerrados puedan entrar,libremente,"sus mugeres hijos y amigos a traelles de comer o comunicar negocios, y que los moriscos viejos y personas seguras",–mente,cancilleresco,37.1773363,-3.598557
CODEA-0032,1571,XVI,Granada,Granada,que su Magestad me manda me pareció adbertir aquí lo que se sigue para que mejor se entienda y acierte.,Primeramente,luego que se hayan recevido los despachos de su Magestad que serán con ésta y visto lo que en ellos,–mente,cancilleresco,37.1773363,-3.598557
CODEA-0032,1571,XVI,Granada,Granada,que los tengan a buen recado con apercibimiento que si alguno se fuere se procederá contra su dueño. Adviértese que,solamente,se han de recoger y encerrar los hombres de catorze hasta sesenta años y no los de mayor ni menor,–mente,cancilleresco,37.1773363,-3.598557
CODEA-0032,1571,XVI,Granada,Granada,"y naturalezas y siendo de lugar grande se porná también la vezindad declarando la calle y la parroquia donde bivía,",juntamente,"con los nombres de sus mugeres hijos y familia, y de los viejos, niños y mujeres, que aunque no se",–mente,cancilleresco,37.1773363,-3.598557
CODEA-2719,1571,XVI,Corfú,Corfú,suplico no se canse de tomar a su cargo el procurar la resolución de las cosas que en ellas ban,mayormente,en lo que toca a mi ida a besar las manos de Su Magestad. En caso que me aya mandado,–mente,particular,39.623889,19.82
CODEA-2720,1571,XVI,Corfú,Corfú,que biese cómo quería ser servido la vez que no pudiese comer conmigo que estas serían pocas. Quiso tomarlo tan,ásperamente,cuanto se dexó ver del correo que despachó pocas horas antes que yo otro y por otras dilijencias que si,–mente,particular,39.623889,19.82
CODEA-2720,1571,XVI,Corfú,Corfú,"no dude d'ella ni un punto porque, haziéndose, solamente le abra en mí de gran desgracia, sin otra mezcla que",justamente,"aya de dañarme. Esto digo respondiendo a los consejos no banos sino llenos de mucha salud, que Vm. por hazérmela",–mente,particular,39.623889,19.82
CODEA-2720,1571,XVI,Corfú,Corfú,"estava a lo que a él le pareciese como Vm. abrá ya entendido. Al fin, señor, después acá, no sé",verdaderamente,en qué cosa aya faltado de procurar darle gusto y en esta parte tengo mi causa tan justificada que no,–mente,particular,39.623889,19.82
CODEA-2720,1571,XVI,Corfú,Corfú,de lo que sé encarecer; y esto me anima a desear servir más si es posible avisarme Su Magestad tan,particularmente,"de lo que yo he de hazer para no salir de su boluntad, la cual executaré hasta morir en cuanto",–mente,particular,39.623889,19.82
CODEA-2720,1571,XVI,Corfú,Corfú,"echarlos ni otro padre de quien confiar, por cierto señor príncipe mal, cuya causa deve mover a Vm. a no",solamente,"no cansarse de oírme sino también, lastimado de mi poco abrigo, cubrirme con la capa de mi razón, la cual",–mente,particular,39.623889,19.82
CODEA-2720,1571,XVI,Corfú,Corfú,"pasión del mismo suplico a quien devo y á de conocerla, que no dude d'ella ni un punto, porque, haziéndose,",solamente,le abra en mí de gran desgracia sin otra mezcla que justamente aya de dañarme. Esto digo respondiendo a los,–mente,particular,39.623889,19.82
CODEA-3390,1571,XVI,Corfú,Corfú,suplico no se canse de tomar a su cargo el procurar la resolución de las cosas que en ellas ban,mayormente,en lo que toca a mi ida a besar las manos de su Magestad. En caso que me aya mandado,–mente,particular,39.623889,19.82
CODEA-3405,1571,XVI,Corfú,Corfú,que biese cómo quería ser servido la vez que no pudiese comer conmigo que estas serían pocas. Quiso tomarlo tan,ásperamente,cuanto se dexó ver del correo que despachó pocas horas antes que yo otro y por otras dilijencias que si,–mente,particular,39.623889,19.82
CODEA-3405,1571,XVI,Corfú,Corfú,"no dude d'ella ni un punto porque haziéndose, solamente le abrá en mí de gran desgracia, sin otra mezcla que",justamente,aya de dañarme. Esto digo respondiendo a los consejos no banos sino llenos de mucha salud que V. M. por,–mente,particular,39.623889,19.82
CODEA-3405,1571,XVI,Corfú,Corfú,"a lo que a él le paresciese como V. M. abrá ya entendido. Al fin, señor, después acá, no sé",verdaderamente,"en qué cosa aya faltado de procurar darle gusto y en esta parte tengo mi causa tan justificada, que no",–mente,particular,39.623889,19.82
CODEA-3405,1571,XVI,Corfú,Corfú,"de lo que sé encarescer y esto me anima a desear servir más, si es posible avisarme su Magestad tan",particularmente,de lo que yo he de hazer para no salir de su boluntad la cual executaré hasta morir en cuanto,–mente,particular,39.623889,19.82
CODEA-3405,1571,XVI,Corfú,Corfú,"ni otro padre de quien confiar por cierto señor príncipe mal, cuya causa deve mover a V. M. a no",solamente,"no cansarse de oírme sino también, lastimado de mi poco abrigo, cubrirme con la capa de mi razón, la cual",–mente,particular,39.623889,19.82
CODEA-3405,1571,XVI,Corfú,Corfú,"pasión del mismo suplico a quien devo y á de conoscerla, que no dude d'ella ni un punto, porque haziéndose,",solamente,le abrá en mí de gran desgracia sin otra mezcla que justamente aya de dañarme. Esto digo respondiendo a los,–mente,particular,39.623889,19.82
CODEA-2920,1572,XVI,Segovia,Párraces,"tomóla luego en la mano para verla y teniéndola así en la mano, començó a sudar la sangre y crecer",visiblemente,en una parte de la piedra en la sobreaz d'ella lo cual como viesse el padre visitador dixo con grande,–mente,eclesiástico,40.906314,-4.413361
CODEA-2920,1572,XVI,Segovia,Párraces,"yo echase el dedo que me lo mojaría ¿no ven esto, padres? Fueron luego sus compañeros a verlo y vieron",claramente,"ser ansí como el padre visitador lo dezía que la sangre estava fresca y muy patente sobre la piedra, como",–mente,eclesiástico,40.906314,-4.413361
CODEA-2920,1572,XVI,Segovia,Párraces,que aconteció visitando las reliquias del Colegio Real de Santa María de Párraces. Cosa muy santa es en todo tiempo,especialmente,"en este publicar los milagros y maravillas que Dios hace por las reliquias de sus santos, porque son testimonio de",–mente,eclesiástico,40.906314,-4.413361
CODEA-3180,1572,XVI,Almería,Cuevas del Almanzora,"de los maravedís de su valor hagan pago a vos el dicho Pedro Marco, del principal e cos<…> de todo",cumplidamente,como si lo que dicho es aquí fuese juzgado e sentenciado por juez competente e la sentencia pasada en cosa,–mente,particular,37.296944,-1.879722
CODEA-3181,1572,XVI,Almería,Cuevas del Almanzora,los dichos cuarenta ducados con más las costas que en la cobrança d'ellos se le siguieren y recrecieren de todo,cumplidamente,como si lo que de derecho es así fuese e juzgado y sentenciado por juez competente y la sentencia pasada,–mente,particular,37.296944,-1.879722
CODEA-2973,1572,XVI,Albacete,Albacete,dixeron que los moriscos d'esta villa tienen grande disolución que <en> las fiestas se van a las tavernas a bever,desordenadamente,"de que suceden escándalos entr'ellos que tanto, mandavan e mandaron que de aquí adelante no se junten los dichos moriscos",–mente,municipal,38.99765,-1.86007
CODEA-2973,1572,XVI,Albacete,Albacete,cada vez que lo contrario hizieren dé treszientos maravedís aplicados para obras pías o públicas. E mandaron que se pregone,públicamente,Licenciado Martínez <…>. Manuel de Cañavate. Miguel del Moral. Andrés de Cantos. Francisco Seder de Mesa. <…>. Pero de Molina.,–mente,municipal,38.99765,-1.86007
CODEA-1322,1573,XVI,Madrid,Madrid,"Flandes y de Tirol etcétera, a vós el nuestro corregidor de la ciudad de Segovia, y a vuestro lugarteniente que",ordinariamente,con vós reside en el dicho oficio y a cada uno de vós salud e gracia. Sepades que Antonio de,–mente,cancilleresco,40.4167754,-3.7037901
CODEA-1322,1573,XVI,Madrid,Madrid,firmada de vuestro nombre y signada de escrivano cerrada y sellada y en pública forma y manera que haga fee,juntamente,"con vuestro parecer y contradiciones si sobr'ello oviere, lo dad y entregad a la parte del dicho cabildo y clero",–mente,cancilleresco,40.4167754,-3.7037901
CODEA-3483,1573,XVI,Guadalajara,Mondéjar,tan onrada mujer. Hago saber a vuestra excelencia que el dotor Moço á estado preso porque açotó a su mujer,brabamente,y otro día la sacó a el campo a pasear con una ropa de grana. El rey dizen que biene,–mente,particular,40.3239733,-3.1096078
CODEA-3608,1574,XVI,Badajoz,Badajoz,"por su fin y muerte y aze y començó a hazer inventario de los dichos bienes, que son los siguientes:",primeramente,"un cofre encorado (el más viejo) el cual se abrió, y tenía dentro doze pieças de lienço curadas e arrolladas",–mente,particular,38.8794495,-6.9706535
CODEA-0349,1574,XVI,Valladolid,Valladolid,e incurrido por haber contrabenido a la dicha nuestra carta executoria y sobrecarta de ella lo uno porque estava provado,bastantemente,la contrabención de la dicha carta executoria en haber prendado a Antón Martín y consortes habiéndole hallado cortando leña en,–mente,judicial,41.6294336,-4.2616986
CODEA-0349,1574,XVI,Valladolid,Valladolid,y quinientos y setenta y cuatro años presentó ante ellos una petición en que dixo que se querellava y acusava,criminalmente,"a Diego Díez alcalde ordinario de esa dicha villa de Peñafiel, y Alonso Belázquez Díez, alguazil de ella, y a",–mente,judicial,41.6294336,-4.2616986
CODEA-0349,1574,XVI,Valladolid,Valladolid,e oidores de la dicha nuestra audiencia fueron dadas y libradas lo cual todo por parte de el dicho monesterio,originalmente,vos será mostrado y los dichos autos y mandamientos que ansí mismo por los dichos nuestro presidente e oidores de,–mente,judicial,41.6294336,-4.2616986
CODEA-0349,1574,XVI,Valladolid,Valladolid,lo era de la dicha villa su parte mayormente que si a ello se hobiese de dar lugar era ir,derechamente,contra la dicha carta executoria y porque combenía que los dichos montes se conserbasen y no se talasen ni sacasen,–mente,judicial,41.6294336,-4.2616986
