ID,Fecha,Siglo,Provincia,Población,Cont_anterior,Forma,Cont_posterior,Variante,Ámbito,Latitud,Longitud
CODEA-0942,1498,XV,Huesca,Huesca,"solas simples paravlas sines testimonios, jura e toda otra manera de probación requerida, e sí por tener, e complir e",firmement,observar todas e cadaúnas cossas sobreditas e diusso escritas e en los preinsertos capítoles e cualquiere d'ellos contenidas puestas e,–ment,eclesiástico,42.131845,-0.4078058
CODEA-0942,1498,XV,Huesca,Huesca,tenida en los ditos e preinsertos capítoles de concordia juxta su continencia e tenor pagar satisfer e emendar bien e,complidament,de los cuales e de las cuales quisieron e expresament consintieron las sobreditas partes e cadaúna d'ellas cadaúna por su,–ment,eclesiástico,42.131845,-0.4078058
CODEA-0942,1498,XV,Huesca,Huesca,antepassados que los ditos prior e fraires del dito monesterio sean tenidos capitularment e conventual obligados de celebrar e cantar,perpetuament,"cadaún viernes de cada semana una missa de la cruz cantada <…> de la passión de Nuestro Señor Jesucristo, e",–ment,eclesiástico,42.131845,-0.4078058
CODEA-0942,1498,XV,Huesca,Huesca,"en los preinsertos e presentes capítoles puestas e contenidas las cuales e cadaúna d'ellas quisieron e espresament consintieron, quieren e",expresament,consienten aquí seyer avidos por repetidos e expressados bien assí como si de paravla a paravla aquí fuessen recitadas e,–ment,eclesiástico,42.131845,-0.4078058
CODEA-0942,1498,XV,Huesca,Huesca,"su continencia e tenor pagar satisfer e emendar bien e complidament, de los cuales e de las cuales quisieron e",expresament,consintieron las sobreditas partes e cadaúna d'ellas cadaúna por su part por lo que le toca fuessen e sean creídos,–ment,eclesiástico,42.131845,-0.4078058
CODEA-0833,1499,XV,Zaragoza,Calatayud,"e general administración e plenísima potestat para intentar las otras acciones personales e directas e otras cualesquiere fazer, procurar e",líberament,exercir en e cerca lo sobredicho todas e cadaúnas que señor en cosa suya propia puede fazer e que yo,–ment,particular,41.3531678,-1.6468455
CODEA-0833,1499,XV,Zaragoza,Calatayud,juro por Dios la cruz e los Santos Cuatro Evangelios de Nuestro Señor Jesucristo ante mí puestos e por mí,manualment,tocados que las sobredichas casas e tañerías que yo a vós vendo no son vendidas ni transportadas a persona otra,–ment,particular,41.3531678,-1.6468455
CODEA-0833,1499,XV,Zaragoza,Calatayud,en aquéllas a vuestra propia voluntat como de bienes e cosa vuestra propia segunt que lo sobredicho millor e más,sanament,a todo provecho vuestro e de los vuestros toda contrariedat mía e de los míos cessant; e de todo el,–ment,particular,41.3531678,-1.6468455
CODEA-0833,1499,XV,Zaragoza,Calatayud,socorre e ayuda a los decebidos e engañados en las vendiciones fechas ultra la meitat del justo precio; querient e,expressament,"consintient que vós dicho comprador, e los vuestros e quien vós de aquí adelant querredes, ayades, tengades, possidades e espleitedes",–ment,particular,41.3531678,-1.6468455
CODEA-0833,1499,XV,Zaragoza,Calatayud,"de los Francos habitant en la ciudat de Calatayut, de mi cierta ciencia e de todos mis derechos bien e",plenerament,certificado e informado con e por títol de la present carta pública de vendición a todos tiempos seyer firme e,–ment,particular,41.3531678,-1.6468455
CODEA-0460,1500,XVI,León,Vega de Espinareda,Salvante el señorío e el diezmo de pan esta dicha guguería e con todas las cosas que ende nos pertenecen,salvament,"el señorío e diezmo de pan segund dicho es, vos aforamos e damos a fuero por en todos los días",–ment,eclesiástico,42.7215806,-6.656295
CODEA-0943,1500,XVI,Huesca,Huesca,nombre vuestro e no en otra manera tener e posseír aquélla entro a en tanto que ayades presso e tengades,actualment,"la posessión e podades e vos sea lícito prender por vuestra propria auctoridat sines sentencia e auctoridat de judge alguno,",–ment,eclesiástico,42.131845,-0.4078058
CODEA-0943,1500,XVI,Huesca,Huesca,"forçado falagado, decibido, ni engañado, ni por algún error induzido, antes de mi buen grado e de mi cierta ciencia",conselladament,"e acordada e certificado plenariament de todo mi dreito en todo e por todas cossas, con e por títol e",–ment,eclesiástico,42.131845,-0.4078058
CODEA-0943,1500,XVI,Huesca,Huesca,siquiere tal fiança de salvo de la dita donación e cessión segunt dreito e fuero de Aragón segunt dito es;,volenterossament,"me constituezco seyer fiança dius obligación de todos mis bienes, mobles e sedientes, avidos e por aver, en todo lugar,",–ment,eclesiástico,42.131845,-0.4078058
CODEA-0943,1500,XVI,Huesca,Huesca,"ni por algún error induzido antes de mi buen grado e de mi cierta ciencia conselladament e acordada, e certificado",plenariament,de todo mi dreito en todo e por todas cossas con e por títol e tenor del present público instrument,–ment,eclesiástico,42.131845,-0.4078058
CODEA-0943,1500,XVI,Huesca,Huesca,"possidades e espleitedes perpetuament la dita viña de partes desusso confruentada nombrada e especificada, que a vós dó e cedo",salvament,"franca líbera e en paz, e ayades aquélla pora vós e a los del tal dito convento, pora dar, vender,",–ment,eclesiástico,42.131845,-0.4078058
CODEA-0943,1500,XVI,Huesca,Huesca,"vós e a los vuestros successores en el dito convento e pora qui vós d'aquí adelant querredes, ordenaredes e mandaredes",perpetuament,"es a saber de una viña sita en el término de Conillevigue, término de la dita ciudat, franca e quita,",–ment,eclesiástico,42.131845,-0.4078058
CODEA-0943,1500,XVI,Huesca,Huesca,"fraires e convento e los vuestros e qui vós de aquí adelant querredes, ordenaredes e mandaredes, tengades, possidades e espleitedes",perpetuament,"la dita viña de partes desusso confruentada nombrada e especificada, que a vós dó e cedo salvament, franca, líbera e",–ment,eclesiástico,42.131845,-0.4078058
CODEA-0943,1500,XVI,Huesca,Huesca,franca exceptado de un sueldo de trehúdo a la seu de Huesca por el mes de setiembre pagadero. Querient e,expresament,"consintient yo dito Martín de Samper donant, que vós ditos prior, fraires e convento, e los vuestros e qui vós",–ment,eclesiástico,42.131845,-0.4078058
CODEA-0943,1500,XVI,Huesca,Huesca,"tal revocación sía nula e inválida e sin alguna eficacio o balor, bien assí como si feita no fuesse, renunciant",expresament,"yo dito Martín de Samper donant, a la ley o dreito la donación feita entre bivos poderse revocar por causa",–ment,eclesiástico,42.131845,-0.4078058
CODEA-0943,1500,XVI,Huesca,Huesca,de Samper a vós ditos prior fraires e convento e los vuestros toda aquélla forma e manera que millor más,sanament,"e más proveitossa se puede e deve dezir e entender a todo proveito utilidat, salvamiento e buen entendimiento vuestro e",–ment,eclesiástico,42.131845,-0.4078058
CODEA-0835,1502,XVI,Zaragoza,Munébrega,caso queremos que podades aver recurso e actión a las dichas especiales obligaciones e podades aquéllas vender y fazer vender,sumariament,mediant cualquiere juge del precio de aquéllas entregarvos de quequiere que por la sobredicha razón vos avrá convenido perder y,–ment,particular,41.2513238,-1.7058402
CODEA-0835,1502,XVI,Zaragoza,Munébrega,"e Inés Pujadas cónjuges, vezinos del lugar de Munébrega, aldea de la ciudat de Calatayut, de nuestras ciertas ciencias, certificados",plenariament,"de todo nuestro derecho y de cadaúno de nós en todo y por todas cosas por nosotros, los nuestros presentes",–ment,particular,41.2513238,-1.7058402
CODEA-0838,1506,XVI,Zaragoza,Calatayud,"señora Santa María la Peña ad arbitrio de mis exsecutores infrascritos se ayan renda de aquéllos, y que se formen",devidament,segunt se costumbran fazer y celebrar en la dicha iglesia. Item atendido assí mesmo dexo que el residuo de mis,–ment,particular,41.3531678,-1.6468455
CODEA-0838,1506,XVI,Zaragoza,Calatayud,en el precalendado mi último testament fago y ordeno mi último codicillo en la forma y manera siguient e infrascrita.,Primerament,atendido que en mi último testament dexava y dexo que por mis exsecutores fuessen complidas mis lexas dentro tiempo de,–ment,particular,41.3531678,-1.6468455
CODEA-0838,1506,XVI,Zaragoza,Calatayud,mi mortorio y fulnerias agora quiero y mando por el present codicillo no sían sino de cada tres libras tan,solament,poco más o menos. Item assí mesmo atendido dexo en el dicho mi testament que me sían cantados por los,–ment,particular,41.3531678,-1.6468455
CODEA-0838,1506,XVI,Zaragoza,Calatayud,la ciudat cuatro trentenarios del oficio de Sant Amador por el present mi codicillo no quiero sían sino tres tan,solament,"a saber son los del Carmen, los de la Mercet y de Sant Pedro Mártil, y en la dicha Capilla",–ment,particular,41.3531678,-1.6468455
CODEA-0838,1506,XVI,Zaragoza,Calatayud,"y postrimera voluntat y <…> de todos mis bienes, mobles y sedientes, avidos y por aver doquiere, segunt que más",largament,consta por aquél que fecho fue en la ciudat de Calatayut a cuatro días del mes de abril año recebido,–ment,particular,41.3531678,-1.6468455
CODEA-3148,1514,XVI,Huesca,Jaca,vuestra propia para fazer exercir e procurar todas e cadaúnas cosas que buenos e bastantes procuradores atales o semblantes actos,legítimament,"constituidos pueden e deven fazer e que yo dicho vendedor faría e fer poría ante de la present vendición, e",–ment,particular,42.5717165,-0.5470553
CODEA-3148,1514,XVI,Huesca,Jaca,de todas e cadaúnas cosas sobredichas los cuales quiero que sían sacados de donde <…>intare e trobados serán e vendidos,sumariament,"sines solempnidat alguna de fuero y drecho y del precio de aquellos vos entreguedes de todas e cadaúnas cosas sobredichas,",–ment,particular,42.5717165,-0.5470553
CODEA-3148,1514,XVI,Huesca,Jaca,"pública de vendición podades vós dicho comprador, e los vuestros e los qui vos d'aquí adelant querredes, ordenaredes e mandaredes",francament,usar e experir en judicio e fuera de judicio a vuestro querer e voluntad con líbera e general administración de,–ment,particular,42.5717165,-0.5470553
CODEA-3148,1514,XVI,Huesca,Jaca,"y con carrera pública assí como las dichas afrontaciones encierran, circundan e departen en derredor el dicho patio, assí aquel",éntregament,del cielo fasta los abissos de la tierra con todas sus entradas y sallidas e con todos sus drechos vertientes,–ment,particular,42.5717165,-0.5470553
CODEA-3148,1514,XVI,Huesca,Jaca,suyas simples palabras sines testimonios jura e toda otra manera de probación requerida. E por todas e cadaúnas cosas sobredichas,firmement,tener e complir obligo a vós todos mis bienes mobles y sedientes havidos y por haver en todo lugar e,–ment,particular,42.5717165,-0.5470553
CODEA-3148,1514,XVI,Huesca,Jaca,"manera fins que vós o los vuestros o otri por vós hayades recebido la possessión de aquel querient, atorgant e",expressament,"consentient que vós dicho comprador e los vuestros e quien vós de aquí adelante querredes ordenaredes e mandaredes hayades, tengades,",–ment,particular,42.5717165,-0.5470553
CODEA-0825,1522,XVI,Teruel,La Puebla de Valverde,"la Puebla de Valverde aldea de la ciudat de Teruel, de nuestras ciertas ciencias, no forçados, seduzidos ni engañados antes",aconsejadament,por nosotros y por nuestros sucessores presentes y advenideros con títol e testimonio de aquesta present carta pública de vendición,–ment,eclesiástico,40.2253186,-0.9301201
CODEA-0825,1522,XVI,Teruel,La Puebla de Valverde,"ermandat dote y esposalicio, y a todos y cualesquiere auxilios, beneficios y defensiones en favor de mugeres trobados. E queremos",finalment,nós ditos suso obligados y expressament consentimos que vosotros ditos vicario y clérigos beneficiados o los sucessores vuestros podáis y,–ment,eclesiástico,40.2253186,-0.9301201
CODEA-0825,1522,XVI,Teruel,La Puebla de Valverde,cual nosotros tenemos y possedimos sitiada en las Clochas afruenta con eredat de Antón Caudet y con las carvoneras; y,generalment,sobre nuestras personas y nuestros bienes assín mobles como sitios avidos y por aver et cetera. Los cuales ditos dos,–ment,eclesiástico,40.2253186,-0.9301201
CODEA-0825,1522,XVI,Teruel,La Puebla de Valverde,cual nosotros tenemos y possedimos sitiada en las Clochas afruenta con eredat de Antón Caudet y con las carvoneras; y,generalment,sobre nuestras personas y nuestros bienes assín mobles como sitios avidos y por aver et cetera. Los cuales ditos dos,–ment,eclesiástico,40.2253186,-0.9301201
CODEA-0825,1522,XVI,Teruel,La Puebla de Valverde,o segunt cualquiere otro fuero que más vosotros dichos vicario y clérigos beneficiados querréis y elegiréis pagaderos en cadaún año,perpetualment,el domingo de Casimodo y será la primera paga el primero de março del año mil quinientos vintitrés e asín,–ment,eclesiástico,40.2253186,-0.9301201
CODEA-0825,1522,XVI,Teruel,La Puebla de Valverde,todos y cualesquiere auxilios beneficios y defensiones en favor de mugeres trobados. E queremos finalment nós ditos suso obligados y,expressament,consentimos que vosotros ditos vicario y clérigos beneficiados o los sucessores vuestros podáis y puedan variar jutge e judicio et,–ment,eclesiástico,40.2253186,-0.9301201
CODEA-0757,1522,XVI,Teruel,Sarrión,"mi buen seso y recuerdo y manifiesta palabra e yo dicha Catalina estando sana por gracia de Dios, los dos",juntament,"e unánime conforme fazemos e ordenamos este nuestro último testamento e nuestra última voluntat el cual queremos que sía firme,",–ment,particular,40.1411609,-0.811547
CODEA-0757,1522,XVI,Teruel,Sarrión,que si algunos pobres avrá de nuestra generación o digo de la generación del que primero fallecerá que aquellos sían,principalment,suvenidos de dicha almosna demandándola pues no la demande viciossament e si fuesse casso que el que será sobrevivient puesto,–ment,particular,40.1411609,-0.811547
CODEA-0757,1522,XVI,Teruel,Sarrión,de la generación del que primero fallecerá que aquellos sían principalment suvenidos de dicha almosna demandándola pues no la demande,viciossament,e si fuesse casso que el que será sobrevivient puesto casso que se casase e viviés en estrema necesidat o,–ment,particular,40.1411609,-0.811547
CODEA-0757,1522,XVI,Teruel,Sarrión,nós y cualquiere de nós ante de la present jornada fecho o fechos los cuales de ningún valor sían. Item,primerament,"que encomendamos nuestras ánimas a Dios nuestro creador, suplicando a su misericordia e infinita bondat nos quiera perdonar nuestros pecados",–ment,particular,40.1411609,-0.811547
CODEA-0757,1522,XVI,Teruel,Sarrión,instituida por en Pere Aparici <…> e ensemble con aquella sía perpetualment distribuida a pobres vergoñantes del lugar de Sarrión,perpetuament,pero que si algunos pobres avrá de nuestra generación o digo de la generación del que primero fallecerá que aquellos,–ment,particular,40.1411609,-0.811547
CODEA-0757,1522,XVI,Teruel,Sarrión,serán sía dada y encorporada e ajusta al almosna instituida por en Pere Aparici <…> e ensemble con aquella sía,perpetualment,distribuida a pobres vergoñantes del lugar de Sarrión perpetuament pero que si algunos pobres avrá de nuestra generación o digo,–ment,particular,40.1411609,-0.811547
CODEA-3151,1528,XVI,Huesca,Jaca,en cualquier manera todos aquellos prometieron y se obligaron las dichas partes y la una a la otra e viceverssa,complidament,pagar sanfer y enmendar a su propria voluntat; de los cuales y de las cuales quisieron y espressamente consentieron las,–ment,particular,42.5717165,-0.5470553
CODEA-3151,1528,XVI,Huesca,Jaca,concluido entre los dichos Pedro de Araus y Catalina de la Casa los cuales capítoles son segunt se siguen. E,primerament,ha sido concordado entre las dichas partes qu'el dicho Pedro de Arauz haya de tomar y tome por muxer y,–ment,particular,42.5717165,-0.5470553
CODEA-3419,1566,XVI,La Coruña,"Monasterio de San Paio de Antealtares, Santiago de Compostela",habéis de hazer para el primero año que gozáredes y vos aprovecháredes del dicho lugar e otros en vuestro nombre,llanament,y ansí en cada un año. E vos hazemos el dicho fuero del dicho lugar con lo a el anexo,–ment,particular,42.880556,-8.543056
CODEA-0416,1233,XIII,Zamora,s.l.,ye por fazer ela claustra de esse mismo lugar ye esta avenencia fago con elos per tal pleito que elos,lealmente,"nos ayuden a demandar todas elas debdas así elas negadas cuomo elas otras que son manifestadas, ye elos todos meter",–mente,particular,41.50368,-5.743778
CODEA-0561,1259,XIII,Asturias,s.l.,Coñucida cosa sea a cuantos esta carta virent e oírent que yo Orraca Febréirez,ayuntadamente,"con mios fillos Ruy Matios García Matios, Allonza Matios; e yo Allonza Febréirez con mio fillo Suer Rodríguiz; yo María",–mente,eclesiástico,43.36026,-5.844759
CODEA-0561,1259,XIII,Asturias,s.l.,de Oviedo; don Gonzalo Gil adelantrado mayor del rey en regno de León; ye yo Orraca Febréirez con mios fillos,ayuntadamente,"Ruy Matios García Matios, Allonza Matios; e yo Allonza Febréirez con mio fillo Suer Rodríguiz; e yo María Febréirez; e",–mente,eclesiástico,43.36026,-5.844759
CODEA-0567,1261,XIII,Asturias,s.l.,"Coñoçuda cosa seya a cuantos esta carta viren e oíren que nós abat don Frola,",ajuntadamente,"con el conviento d'es mismo logar de la una parte, e del otra parte Pedro Díaz de Ondes, fazemos carta",–mente,eclesiástico,43.36026,-5.844759
CODEA-0567,1261,XIII,Asturias,s.l.,obispo en Oviedo. Tenendo Miranda Álvar Fernándiz de mano de Deane. E nós abat e conviento e vós Pedro Díaz,ajuntadamente,esta carta que mandamos fazer de la una e del otra parte otorgamos e confirmamos e signo fazemos ante testes,–mente,eclesiástico,43.36026,-5.844759
CODEA-0665,1262,XIII,La Rioja,s.l.,"con aguas e con pastos, e con montes, e con fuentes e con todos aquellos derechos que nós ý avemos,",sanamente,dado bueno e éntrego e sin entredicho ninguno. E dólo en tal manera que cada año el conviento del monesterio,–mente,eclesiástico,42.46577,-2.449995
CODEA-0665,1262,XIII,La Rioja,s.l.,"todas las compras cuantas en Huércanos compré con la sobredicha doña Sancha Gil mi mugier, a qui dé Dios paraíso,",éntregamente,"con entradas e con sallidas e con aguas, e con pastos, e con montes, e con fuentes e con todos",–mente,eclesiástico,42.46577,-2.449995
CODEA-0585,1273,XIII,León,Astorga,ou arbidios; e entón logo dixo el deán que se nos non pudiesse avenir que desampararía el pleito e peró,finalmente,logo dixo qu'ello non quería desemparar a menos de mandar entre nós ello que toviesse por bien. Fecho fu esto,–mente,eclesiástico,42.4549303,-6.0532511
CODEA-0586,1273,XIII,León,Astorga,"que en presencia de mí Joán Paiz público notario de la iglesia de Astorga, e de los testimonios deyuso escritos",especialmente,"a esto rogados e xamados: don Velasco Pérez deán de Astorga, Martín Domínguez, clérigo del coro, procurador de Joán García,",–mente,eclesiástico,42.4549303,-6.0532511
CODEA-1881,1274,XIII,Cáceres,Plasencia,e sin otro alongamiento ninguno. Et nós los concejos sobredichos otorgamos de fazer <nuestra> hermandat e esta postura bien e,lealmente,"<…> sin mal engaño. Et por que esto sea firme e estable e non venga en dubda, nós los concejos",–mente,municipal,40.0420954,-6.0838065
CODEA-0619,1274,XIII,Sevilla,Sevilla,de lino e el arçobispo e su cabillo que pongan sus terceros en cada lugar que lo recabden bien e,lealmente,con los nuestros terceros e los comendadores que los ayuden que ayan su derecho bien e complidamente. E otorgamos que,–mente,municipal,37.3890924,-5.9844588
CODEA-0619,1274,XIII,Sevilla,Sevilla,nuestro cabillo e nós dicho maestre con nuestro cabillo e con nuestra orden guardar todas las cosas sobrescritas bien e,lealmente,"a buena fe sen mal engaño e amarnos e querernos bien nós arçobispo e nuestro cabillo a vuestra orden, e",–mente,municipal,37.3890924,-5.9844588
CODEA-0619,1274,XIII,Sevilla,Sevilla,recabden bien e lealmente con los nuestros terceros e los comendadores que los ayuden que ayan su derecho bien e,complidamente,E otorgamos que aya el arçobispo la meitad de los sacrilegios cuando acaecieren en los logares sobredichos. E otrossí otorgamos,–mente,municipal,37.3890924,-5.9844588
CODEA-0653,1274,XIII,Sevilla,Sevilla,de lino. E el arçobispo e su cabillo que pongan sus terceros en cada logar que lo recabden bien e,lealmente,con los nuestros terceros e los comendadores que les ayuden que ayan su derecho bien e complidamente. E otorgamos que,–mente,eclesiástico,37.3890924,-5.9844588
CODEA-0653,1274,XIII,Sevilla,Sevilla,nuestro cabillo e nós dicho maestre con nuestro cabillo e con nuestra orden guardar todas las cosas sobredichas bien e,lealmente,"a buen fe sin mal engaño e amarnos e querernos bien, nós arçobispo e nuestro cabillo a vuestra orden, e",–mente,eclesiástico,37.3890924,-5.9844588
CODEA-0653,1274,XIII,Sevilla,Sevilla,recabden bien e lealmente con los nuestros terceros e los comendadores que les ayuden que ayan su derecho bien e,complidamente,E otorgamos que oya el arçobispo la meitad de los sacrilegios cuando acaecieren en los logares sobreditos. E otrossí otorgamos,–mente,eclesiástico,37.3890924,-5.9844588
CODEA-0781,1274,XIII,Burgos,Burgos,"todas las partes de mios regnos e non faciendo daño en viñas, ni en mieses nin en prados defesados, defiendo",firmemente,"que ninguno non sea osado de los peindrar nin de los contrallar nin de los embargar por portadgo, nin por",–mente,cancilleresco,42.3439925,-3.696906
CODEA-2348,1274,XIII,Castellón,San Mateo,"o querella oviesse de alguno de sus vezinos que pareciessen ante los alcaldes de ý, et que passasse el pleito",primeramente,"por ellos et desi qui se agraviasse de su juizio, que le diessen el alçada como es fuero et derecho.",–mente,cancilleresco,40.465033,0.179319
CODEA-0005,1278,XIII,Segovia,Segovia,sus derechos en aquellos logares do los deven dar e non sacando cosas vedadas de mis regnos. Mando e defiendo,firmemente,que ninguno non sea osado de los embargar nin de los contrallar nin de los pendrar por ninguna razón si,–mente,cancilleresco,40.9429032,-4.1088068
CODEA-2180,1286,XIII,Toledo,Toledo,"Trenidat Padre, Fijo, Espíritu Santo, un Dios verdadero, temiendo la muerte, de la cual omne del mundo non puede estorcer,",primeramente,"mando que después que yo finare que sepan mis alvacés los que aquí serán dichos, todo mi aver mueble e",–mente,particular,39.8628316,-4.0273231
CODEA-0890,1287,XIII,Navarra,s.l.,devo por cualquier raçón del cielo fasta en la tierra a vós los dichos abat e convento de Fitero todo,éntregamente,por el precio sobredicho. E yo Miguell Pérez de Lardero el sobredicho otorgo que só bien pagado a toda mi,–mente,particular,42.81721,-1.646767
CODEA-1106,1291,XIII,Valladolid,Valladolid,la eglesia de Toledo su señorío e que les fagan los fueros e les den todos sus derechos bien e,complidamente,assí como lo usaron siempre fasta aquel día que les nós diemos el privilegio sobredicho de la cavallería. E non,–mente,cancilleresco,41.6294336,-4.2616986
CODEA-0079,1293,XIII,Zamora,Toro,que ovieron fasta aquí e ovieren adelante heredamientos cualesquier en las aldeas que den la meatad del diezmo bien e,complidamente,en las aldeas allí do son los heredamientos e la otra meatad en la cibdat de Ávila ó fueren parroquianos,–mente,cancilleresco,41.5274417,-5.3913374
CODEA-0007,1295,XIII,Valladolid,Valladolid,omnes e de los otros omnes bonos que <…> ordenamos damos e confirmamos e otorgámosles estas cosas para siempre jamás:,primeramente,"que <les confirmamos> sus fueros e sus privilegios e cartas e franquezas e libertades, e usos e costumbres que ovieron",–mente,cancilleresco,41.6294336,-4.2616986
CODEA-2181,1295,XIII,Toledo,Toledo,caldera e dos paneros e un cubrepán e una cubierta; e passó a mi poder todo esto sobredicho bien e,complidamente,"E yo Yuañes Caro e yo su fiador Blasco Pérez su hermano, nos obligamos con todos nuestros bienes, muebles e",–mente,particular,39.8628316,-4.0273231
CODEA-0088,1296,XIII,Valladolid,Valladolid,"e de Sant Bartolomé e de Malpartida vasallos del obispo sobredicho, otórgoles esta carta y confírmogela, e mando e defiendo",firmemente,que ningún cojedor ni sobrecojedor nin alcalle nin otro aportellado ninguno non sea osado de entrar en estos lugares por,–mente,cancilleresco,41.6294336,-4.2616986
CODEA-0088,1296,XIII,Valladolid,Valladolid,de entrar en estos lugares por razón de demandelles nin pendralles por pecho ninguno mas pechen al obispo bien e,complidamente,segunt pecharon fasta aquí. E cualquier que lo ficiese pechar m'ía en pena mill maravedís de la moneda nueva e,–mente,cancilleresco,41.6294336,-4.2616986
CODEA-0399,1297,XIII,Valladolid,Valladolid,"que vala e les sea guardada en todo tiempo bien e complidamente, segunt en ella dize e mando e defiendo",firmemente,que ninguno non sea osado de ir nin de pasar contra ella en ninguna cosa de lo que sobredicho es,–mente,cancilleresco,41.6294336,-4.2616986
CODEA-0399,1297,XIII,Valladolid,Valladolid,por les fazer bien e merced confírmogela e mando que vala e les sea guardada en todo tiempo bien e,complidamente,segunt en ella dize e mando e defiendo firmemente que ninguno non sea osado de ir nin de pasar contra,–mente,cancilleresco,41.6294336,-4.2616986
CODEA-0319,1298,XIII,Valladolid,Valladolid,yantares que son demandadas en dineros que las non den si non cuando yo ý acaeciere. Et mando e defiendo,firmemente,que ningún cogedor nin sobrecogedor nin recibidor de los pechos nin de las yantares nin a otro omne ninguno non,–mente,cancilleresco,41.6294336,-4.2616986
