ID,Fecha,Siglo,Provincia,Población,Cont_anterior,Forma,Cont_posterior,Variante,Ámbito,Latitud,Longitud
CODEA-0484,1270,XIII,Toledo,Toledo,"e a cuanto que oviesse nos tornariemos por ello. Dada en Sevilla. El Rey la mandó miercoles, X días de","noviembre,","era de mil MCCLXXXXVIII años. Joán Domínguez la fizo por mandado de Pero Lorenço arcediano de Cadiz. E nós, el",-iembre,eclesiástico,39.8628316,-4.0273231
CODEA-0523,1462,XV,Salamanca,Almenara de Tormes,fuesen d'ello testigos. Que fue fecha e otorgada en el dicho lugar de Almenara a quinze días del mes de,"noviembre,",año del nacimiento del Nuestro Señor Jesucristo de mill e cuatrocientos e sesenta e dos años. Testigos que a esto,-iembre,particular,41.0630612,-5.8228576
CODEA-0553,1430,XV,Salamanca,Béjar,faga escrivir esta carta e la signe con su signo. Fecha en Béjar diez e seis días del mes de,"noviembre,",año del nacimiento del Nuestro Salvador Jesucristo de mil e cuatrocientos e treinta años. Testigos que a esto fueron presentes:,-iembre,particular,40.3871165,-5.7642171
CODEA-0677,1413,XV,Zamora,Monasterio de Santa María del Valle,"Valle e otros. Fecha en el dicho Monesterio de Santa María del Valle, diez e siete días del mes de","noviembre,","año del nacemiento de nuestro señor Jesucristo de mil e cuatrocientos e treze años. E yo Diego Ruiz de Benavente,",-iembre,particular,42.06986,-5.716774
CODEA-0722,1390,XIV,Cantabria,Monasterio de Santo Toribio de Liébana,nos dedes en cada año cinco eminas de trigo e media cántara de vino el día de Sant Martín de,"noviembre,",según que jelo pagan los otros vasallos del dicho concejo de Tanarrio. E si non dierdes nin pagardes la dicha,-iembre,eclesiástico,43.150333,-4.654339
CODEA-0731,1415,XV,Cantabria,s.l.,en enfurción cada año cinco eminas de trigo e ocho açumbres de vino por la fiesta de Sant Martín de,"noviembre,",segund que lo dan e pagan los otros vasalos míos e del dicho monesterio e que fagades todos los otros,-iembre,eclesiástico,43.46096,-3.807934
CODEA-0732,1404,XV,Cantabria,Monasterio de Santo Toribio de Liébana,aya un cuarto de trigo e un par de gallinas e seis dineros por la fiesta de Sant Martín de,"noviembre,","segund que se pagan las otras enfurciones al dicho monesterio. E nós los dichos Joán Ferrández clérigo, e Martín Pérez,",-iembre,eclesiástico,43.150333,-4.654339
CODEA-0733,1471,XV,Cantabria,Potes,"al dicho monesterio bueno de dar e de tomar, por la medida dicha, por el día de Sant Martín de","noviembre,",e que non pueda levar el dicho solar e préstamos salvo toda vía un heredero. E si non compliere lo,-iembre,eclesiástico,43.1535975,-4.6236112
CODEA-0737,1388,XIV,Cantabria,s.l.,del dicho solar porque me dedes en cad'año tres panes e una gallina por el día de Sant Martín de,"noviembre,",e porque seades buenos e leales vasallos vós e los que de vós venieren e moraren en este dicho solar,-iembre,eclesiástico,43.46096,-3.807934
CODEA-0738,1388,XIV,Cantabria,s.l.,por la dicha heredat un cuarto de trigo e una cántara de vino por la fiesta de Sant Martín de,"noviembre,",cuando se pagan las otras infurciones e que fagades todos los otros fueros que fazen los otros buenos vasallos al,-iembre,eclesiástico,43.46096,-3.807934
CODEA-0754,1363,XIV,Zaragoza,s.l.,"fue el cual codicillo fue fecho por mí Domingo Ortelano, notario de part deyuso escrito, vint e cinco días de","noviembre,",anno a nativitate Domini millesimo CCCLX primo las cuales cláusulas fazen por el prior e capítol de los calonges de,-iembre,particular,41.65629,-0.8765379
CODEA-0765,1375,XIV,Teruel,Rubielos de Mora,"muebles e seyentes avidos e por aver, do quiere que sean o serán. en Ruvihuelos, V días del mes de","noviembre,","Testimonios d'esto son presentes García Montañés e Bent Yañes vezinos de Ruvihuelos e alcaldes feitizos, a voluntat de las ditas",-iembre,eclesiástico,40.1901266,-0.6541841
CODEA-0793,1418,XV,Teruel,Rubielos de Mora,"e avederos en todo lugar. Que fue fecho en el dito lugar de Ruvihuelos, a catorze días del mes de","noviembre,","Presentes testimonios fueron a las ditas cosas Joán Villanueva sartre, e Ramón Sixón, fijo de Ramón, vezinos de Ruvihuelos. Signo",-iembre,particular,40.1901266,-0.6541841
CODEA-0796,1426,XV,Teruel,Rubielos de Mora,que son o serán trobados. Que fue fecho en el dito lugar de Ruvielos a cinco días del mes de,"noviembre,",Presentes testimonios fueron a las ditas cosas Bartolomé Lucrano e Joán Mascarell vezinos del dito lugar de Ruvielos. Signo de,-iembre,particular,40.1901266,-0.6541841
CODEA-0796,1426,XV,Teruel,Rubielos de Mora,cient soldos reales a siempre valedero e non revocadero. Que fue fecho en Ruvielos a cinco días del mes de,"noviembre,",Presentes testimonios fueron a las ditas cosas Bartolomé Lucrano e Joán Mascarell vezinos del dito lugar de Ruvielos. Signo de,-iembre,particular,40.1901266,-0.6541841
CODEA-0846,1275,XIII,Huesca,s.l.,d'esto don Joán d'Oliván e Domingo Allión ciutadanos de Osca. Esto fue feito X días en exida del mes de,"noviembre,","era millesima CCCXIII. Signo de Benedet de Castellón público notario d'Osca, qui esto escrivié.",-iembre,particular,42.1401,-0.408898
CODEA-0857,1273,XIII,Navarra,Alfaro,"e oyeron presentes e <…> Gil Gómez e Ferrand Pérez, yerno <…>. Fue fecha en Alfaro, diez días andados de","noviembre,","era MCCC undécima. E yo Aparicio público tabellión sobredicho, fu present en esta composición e escriví esta carta por ruego",-iembre,eclesiástico,42.1772977,-1.7502311
CODEA-0860,1296,XIII,Navarra,s.l.,dineros del dicho encens cadaún año por ata la fin del mundo acabada en el primero día del mes de,"noviembre,",segund continuadamientre viniere e cayere en cadaúno de los años ata la fin del mundo complida e acabada sin pleitesía,-iembre,eclesiástico,42.81721,-1.646767
CODEA-0861,1302,XIV,Navarra,s.l.,carta fue escrita en adelant en cadaún año por por la fiesta e día de Todos Santos del mes de,"noviembre,",segund continuadamientre viniere e cayere la dicta fiesta de oy dicto adelant en el dicto mes en cadaún año ata,-iembre,particular,42.81721,-1.646767
CODEA-0883,1385,XIV,Huesca,Huesca,cosas e condiciones sobreditas dius obligación de vuestros bienes. Esto fue feito en Huesca a tretze días del mes de,"noviembre,","Testimonios fueron d'esto Domenge <…> e Blasco Xeménez de <…> escudero, habitantes en Huesca. Signo de mí Andreu Daso, notario",-iembre,particular,42.131845,-0.4078058
CODEA-0904,1405,XV,Zaragoza,Calatayud,sobreditas cossas repugnantes siquiere contradizientes. Feito fue aquesto en el dito lugar de Viliella a cinco días del mes de,"noviembre,","Presentes testimonios fueron a las sobreditas cosas Joán Juañes de Aviñón clérigo de la eglesia del dito lugar de Aviñón,",-iembre,particular,41.3531678,-1.6468455
CODEA-0905,1405,XV,Zaragoza,Calatayud,"aquesto en el dito lugar de Viliella aldea de la dita ciudat de Calatayut, a quinze días del mes de","noviembre,",Presentes testimonios fueron a las sobreditas cosas Bertoloméi Calvo e Andrés Calvo vezinos del dito lugar de Viliella. Signo de,-iembre,eclesiástico,41.3531678,-1.6468455
CODEA-0905,1405,XV,Zaragoza,Calatayud,"aquesto en el dito lugar de Viliella aldea de la dita ciudat de Calatayut, a quinze días del mes de","noviembre,","Presentes testimonios fueron a las sobreditas cosas Bertoloméi Calvo e Andrés Calvo vezinos del lugar de Viliella. Signo de mí,",-iembre,eclesiástico,41.3531678,-1.6468455
CODEA-0906,1405,XV,Zaragoza,Calatayud,con nuestros bienes nos diusmetemos. Feito fue aquesto en la dita ciudat de Calatayú a dizinuev días del mes de,"noviembre,","Testimonios son d'esto los honorables e discretos Joán don Estevanía rector de Villanaroz, de la diócesi de Tortosa, e Joán",-iembre,eclesiástico,41.3531678,-1.6468455
CODEA-0916,1424,XV,Zaragoza,Calatayud,sus aldeas saqué e escreví; la cual actoridat a mí dito notario fue dada a siet días del mes de,"noviembre,",Presentes testimonios fueron de la dita actoridat García Martínez de la Figuera e Lop de Arivel habitantes en la ciudat,-iembre,eclesiástico,41.3531678,-1.6468455
CODEA-0923,1485,XV,Madrid,Alcalá de Henares,En Alcalá primero día de,"noviembre,","año de mill e cuatrocientos e ochenta e cinco años este día estando presentes los honrados señores Juan de Barrionuevo,",-iembre,judicial,40.4819791,-3.3635421
CODEA-0947,1383,XIV,Huesca,Huesca,"sedientes avidos e por aver, en todo lugar. Esto fue feito en la ciudat d'Uesca, último día del mes de","noviembre,","Testimones fueron d'esto Beltrán de Tena e Marguán Ademelque, fillo de Ademelque de Marguán, moro, habidantes en la ciudat d'Uesca.",-iembre,eclesiástico,42.131845,-0.4078058
CODEA-0948,1454,XV,Huesca,Huesca,"de Seral contrastar dilatar o nozer. Esto fue feito en la ciudat de Huesca, a catorze días del mes de","noviembre,","Testimonios fueron d'esto Julián Melero vezino de la dita ciudat de Huesca e Pedro d'Aro, vezino de Tardianta, clamados e",-iembre,particular,42.131845,-0.4078058
CODEA-0966,1322,XIV,Navarra,Pamplona,la viña de Joán Martín el escudero. Estas sobredichas pieça e viña vos trebudamos d'aquí a la Sant Martín de,"noviembre,",e de la Sant Martín ata veint años veint e un fruito cogidos. En esta manera vos trebudamos las dichas,-iembre,eclesiástico,42.812526,-1.6457745
CODEA-1009,1483,XV,Jaén,Jaén,E d'esto otorgué esta carta qu'es fecha en la dicha cibdad de Jaén veinte e dos días del mes de,"noviembre,",año del nacimiento del Nuestro Señor e Salvador Jesucristo de mill e cuatrocientos e ochenta e tres años. Testigos que,-iembre,eclesiástico,37.7795941,-3.7849056
CODEA-1016,1625,XVII,Madrid,s.l.,mis debociones por ella y todo sea en bida de mi señora la marquesa cuya mano veso muchas veces. De,"noviembre,",a 8 días. Doña Ángela de Álaba comendadora de Santa Cruz. La comendadora de Salamanca se escusa a admitir una,-iembre,eclesiástico,40.41669,-3.700346
CODEA-1043,1483,XV,Jaén,Jaén,Qu'es fecha e otorgada esta carta en la dicha cibdad de Jaén a diez e siete días del mes de,"noviembre,",año del nacimiento de Nuestro Salvador Jesucristo de mil e cuatrocientos e ochenta e tres años. Testigos que al otorgamiento,-iembre,particular,37.7795941,-3.7849056
CODEA-1043,1483,XV,Jaén,Jaén,"leal cibdad de Jaén guarda e defendimiento de los regnos de Castilla, sábado veinte e dos días del mes de","noviembre,",año del nacimiento del Nuestro Salvador Jesucristo de mil e cuatrocientos e ochenta e tres años este dicho día estando,-iembre,particular,37.7795941,-3.7849056
CODEA-1043,1483,XV,Jaén,Jaén,lo cual otorgué esta carta e contrato ante notario e testigos yuso escritos. Fecho a diez e siete días de,"noviembre,","año de mil e cuatrocientos e ochenta e tres años. Testigos: el señor tesorero e Benito de Barrionuevo, e Juan",-iembre,particular,37.7795941,-3.7849056
CODEA-1119,1292,XIII,Sevilla,Sevilla,ellos e a lo que oviessen me tornaría por ello. La carta leída dádgela. Dada en Sevilla IIII días de,"noviembre,",era de mill CCCXXX años. Nós el rey don Sancho.,-iembre,cancilleresco,37.3890924,-5.9844588
CODEA-1123,1285,XIII,Sevilla,Sevilla,"privilegio con nuestro seello de plomo. Fecho el privilegio en Sevilla domingo, veint e cinco días andados del mes de","noviembre,",en era de mill e trezientos e veint e tres años. E nós el sobredicho rey don Sancho regnant en,-iembre,cancilleresco,37.3890924,-5.9844588
CODEA-1142,1594,XVI,NA,s.l.,el sello de nuestras armas y refrendada de nuestro secretario infrascrito. Fecha en La Real sobre Herni a XXVI de,"noviembre,","1594 años. Juan Andrea Doria. Por mandado de su excelencia Pompeo Arnolfini. Tomó la razón, Agustín de Oviedo, teniente de",-iembre,particular,NA,NA
CODEA-1188,1459,XV,Palencia,Aguilar de Campoo,escrivir esta carta e la signe con su signo. Fecha en Aguilar de Campó a veinte e cinco días de,"noviembre,",año del nacimiento del Nuestro Señor Jesucristo de mill e cuatrocientos e seis años. Testigos que fueron presentes: García Fernández,-iembre,eclesiástico,42.7931905,-4.2622141
CODEA-1208,1253,XIII,Sevilla,Sevilla,con mio seello de plomo. Fecha la carta en Sevilla por mandado del rey XXV días andados del mes de,"noviembre,",en era de mill e dozientos e novaenta e un año. E yo sobredicho rey don Alfonso regnant en uno,-iembre,cancilleresco,37.3890924,-5.9844588
CODEA-1236,1526,XVI,Zamora,Toro,"la muy noble ciudad de Toro año de mil y quinientos y veinte y seis, a veinte y cinco de","noviembre,","día de Santa Caterina mártir siendo papa Clemente séptimo, rey de España don Carlos, emperador de Alemania, maestro de la",-iembre,eclesiástico,41.5274417,-5.3913374
CODEA-1237,1279,XIII,Santander,Santa María de Cayón,"Joán Ferrández de Levaneyo. Conceyo de Santa Olaya oidores e veedores. Fecha en Carón, domingo, cuatro días por andar de","noviembre,",era de mill e trezientos e XVII años.,-iembre,eclesiástico,43.311389,-3.8525
CODEA-1305,1508,XVI,Sevilla,Sevilla,a cadaúno de vós que lo contrario hiziere. Dada en la cibdad de Sevilla a doze días del mes de,"noviembre,",año del nacimiento de Nuestro Señor Jesucristo de mil e quinientos e ocho años. Yo el rey.,-iembre,cancilleresco,37.3890924,-5.9844588
CODEA-1345,1505,XVI,León,Monasterio de San Andrés de Espinareda,corriere al tiempo de las pagas pagado todo en cadaún año por el día de San Martín del mes de,"noviembre,","las cuales dichas casas vos aforamos e damos por vuestra vida de vós el dicho Luis Chifón clérigo, e más",-iembre,eclesiástico,42.725369,-6.654985
CODEA-1361,1490,XV,Burgos,Burgos,testigos. Que fue fecha e otorgada esta carta en la dicha cibdad de Burgos a dos días del mes de,"noviembre,",año del nacimiento del Nuestro Salvador Jesucristo de mill e cuatrocientos e noventa años de lo cual son testigos que,-iembre,particular,42.3439925,-3.696906
CODEA-1364,1479,XV,Salamanca,Béjar,a los presentes que fuesen d'ello testigos. Que fue otorgada en la villa de Béjar primero día del mes de,"noviembre,",año del nacimiento del Nuestro Salvador Jesucristo de mill e cuatrocientos e setenta e nueve años. Testigos que fueron presentes,-iembre,cancilleresco,40.3871165,-5.7642171
CODEA-1369,1286,XIII,León,León,no a vós e a lo que oviéssedes me tornaría por ello. Dada en Sevilla diez e siete días de,"noviembre,",era de mill e CCC e XXIII años. Yo Joán Martínez la fiz escrevir por mandado del rey e yo,-iembre,cancilleresco,42.5987263,-5.5670959
CODEA-1377,1457,XV,León,León,"escritura de sentencia vieren cómo estando en la noble cibdat de León sábado, veinte e seis días del mes de","noviembre,",año del nacimiento del nuestro Salvador Jesucristo de mill e cuatrocientos e cincuenta <…> años ant'el honrado e discreto varón,-iembre,judicial,42.5987263,-5.5670959
CODEA-1392,1314,XIV,Zamora,Toro,"doblado e demás a vós e a lo que oviéssedes me tornaría por ello. Dada en Burgos, XXV días de","noviembre,","era de mill e CCCXXIIII años. Joán Mateo camarero mayor, la mandó fazer por mandado del rey. Yo Domingo Pérez",-iembre,cancilleresco,41.5274417,-5.3913374
CODEA-1410,1505,XVI,Salamanca,Salamanca,diez mil maravedís para la mi cámara. Dada en la noble cibdad de Salamanca a ventisiete días del mes de,"noviembre,",año del nacimiento del Nuestro Salvador Jesucristo de mil e quinientos e cinco años. Yo Bartolomé Ruiz de Castañeda escrivano,-iembre,judicial,40.9701039,-5.6635397
CODEA-1431,1392,XIV,Burgos,Burgos,"mandamos dar esta nuestra carta sellada con nuestro sello de plomo pendiente dada en Valladolit, veinte e cuatro días de","noviembre,",era de mill e cuatrocientos e diez e siete años. Yo Pedro Ferranz la fiz escrivir por mandado del rey,-iembre,cancilleresco,42.3439925,-3.696906
CODEA-1487,1557,XVI,Sevilla,Écija,Ilustrísimo señor. A nueve del mes de,"noviembre,",por una carta e por la información que llevó Francisco del Castillo di aviso a vuestra señoría así del escándalo,-iembre,cancilleresco,37.5414656,-5.0826741
CODEA-1513,1662,XVII,Madrid,Madrid,"de Omaña vecinos d'esta villa, y en fe d'ello lo firmé en testimonio de verdad. Manué Eguíluz. Madrid, 21 de","noviembre,",1644. Testimonio de la partida en que costa el día que nos cassamos. Zertifico yo el lizenciado don Diego Bravo,-iembre,judicial,40.4167754,-3.7037901
CODEA-1802,1589,XVI,Madrid,Daganzo de Arriba,dentro de nuebe días primeros siguientes que corren y se cuentan desde diez y ocho días del presente mes de,"noviembre,",parezcan ante mí en esta villa a mostrar e presentar cualesquier escrituras e recados que tienen contra el dicho Juan,-iembre,judicial,40.5450297,-3.4574079
CODEA-1884,1426,XV,Badajoz,Mérida,"del dicho Juan Gonçales procurador del dicho concejo, et en presencia del dicho Ruy Sanches, cinco días del mes de","noviembre,",año del nacimiento del nuestro salvador Jesucristo de mill e cuatrocientos e veinte e seis años a la abdiencia de,-iembre,judicial,38.9191439,-6.340805
CODEA-2053,1377,XIV,Burgos,Burgos,porque nós sepamos en cómo cumplides nuestro mandado. Dado el previlegio en la cibdat de Burgos a diez días de,"noviembre,",era de mil e cuatrocientos e quinze años. E nós el sobredicho rey don Enrique reinante en uno con la,-iembre,cancilleresco,42.3439925,-3.696906
CODEA-2067,1370,XIV,Guadalajara,Molina de Aragón,"Gonçález de Ávila e Antonio Martínez Sancho vezinos de Molina. Fecho este traslado en Molina, veinte e seis días de","noviembre,",era de mill e cuatrocientos e ocho años. En el cual dicho mes fue fecho el dicho testamento otorgado e,-iembre,particular,40.346674,-1.8850569
CODEA-2115,1645,XVII,Valencia,Valencia,para las limosnas que se consultan por esta Junta. Vuestra magestad mandará lo que fuere servido. Valencia a 30 de,"noviembre,",1645.,-iembre,particular,39.4699075,-0.3762881
CODEA-2327,1367,XIV,Guadalajara,Molina de Aragón,"María del Conde e Pedro López, clérigo de Ferrería, vezinos de Molina. Fecha esta carta en Molina, treinta días de","noviembre,","era de mill cuatrocientos e cinco años. E yo Gil López, escrivano público de Molina fui presente a esto con",-iembre,particular,40.346674,-1.8850569
CODEA-2348,1274,XIII,Castellón,San Mateo,"en el logar que tengo por bien que puedan aplazar pora ante mí. Dada en Sant Mateo, XXVI días de","noviembre,","era de mill CCC et XII años. Yo Bonamic, la escriví por mandado del rey.",-iembre,cancilleresco,40.465033,0.179319
CODEA-2349,1455,XV,Ávila,Ávila,sepa en cómo se cumple mi mandado. Dada en la cibdad de Ávila veinte e seis días del mes de,"noviembre,",año del nacimiento del Nuestro Señor Jesucristo de mill e cuatrocientos e cincuenta e cinco años. Yo el rey. Yo,-iembre,cancilleresco,40.656685,-4.6812086
CODEA-2350,1455,XV,Ávila,Ávila,que yo sepa en cómo cumplides mi mandado. Dada en la cibdad de Ávila a veinte e seis días de,"noviembre,",año del nacimiento del Nuestro Señor Jesucristo de mill e cuatrocientos e cincuanta e cinco años. Yo el rey. Yo,-iembre,cancilleresco,40.656685,-4.6812086
CODEA-2402,1442,XV,Soria,"Monasterio de Santa María de Huerta, Soria",su signo. Que fue fecha et otorgada esta dicha carta en el dicho monesterio en nueve días del mes de,"noviembre,",año del nascimiento del nascimiento del nuestro salvador Jesucristo de mille et cuatrocientos et cuarenta e dos años. Testigos que,-iembre,eclesiástico,41.26208,-2.17508
CODEA-2626,1252,XIII,Badajoz,Badajoz,d'aquí adelantre que non la den nin gela demande ninguno. Dada en Badajoz por mandado del rey XVIII días de,"noviembre,",en la era de mil et dozientos et novaenta años. Joán Rodríguez la escrivió.,-iembre,cancilleresco,38.8794495,-6.9706535
CODEA-2639,1274,XIII,Valencia,Valencia,la ý quisieren traer a vender. Et non fagades ende ál por ninguna guisa. Dada en Valencia XX días de,"noviembre,","era de mill e CCC e doze años. Yo Bonamic, la fiz escrevir por mandado del rey. Roy Martínez.",-iembre,cancilleresco,39.4699075,-0.3762881
CODEA-2655,1564,XVI,Tarragona,Tarragona,muy magnífica persona de vuestra merced y con aumento de estado conserve. D'esta su ciudad de Tarragona a siete de,"noviembre,","1564. Besa las manos a vuestra merced su más recto servidor el arçobispo de Tarragona. El arçobispo de Tarragona, a",-iembre,eclesiástico,41.11868,1.24532
CODEA-2655,1564,XVI,Tarragona,Tarragona,"las manos a vuestra merced su más recto servidor el arçobispo de Tarragona. El arçobispo de Tarragona, a VII de","noviembre,","1564. Al ilustre y muy magnífico señor el secretario Gonçalo Pérez mi señor, del Consejo de su magestad.",-iembre,eclesiástico,41.11868,1.24532
CODEA-3002,1697,XVII,Madrid,Alcalá de Henares,soto a quinientos reales cada uno para las fiestas que se hicieron por esta ciudad a Sus Magestades. Alcalá y,"noviembre,",veinte y cuatro de mil seiscientos y noventa y siete. Son 4 mil reales vellón. Juan Fernández.,-iembre,municipal,40.4819791,-3.3635421
CODEA-3253,1809,XIX,Navarra,Pamplona,"36 mil reales el otro hasta 50 mil, y yo he revajado de 55700 que suman las tres partidas por","noviembre,","obra pía y alcaldía a 4500 de que revavados los 2 mil de casa me quedan 2500 para comer, vestir",-iembre,particular,42.812526,-1.6457745
CODEA-3265,1744,XVIII,Madrid,Madrid,Madrid y,"noviembre,","10 de 1744. Primero gracias a Dios que mejora seniora. Yo tengo <a> Antoñico con un gran sarampión, y me",-iembre,particular,40.4167754,-3.7037901
CODEA-3271,1836,XIX,Jaén,Santo Tomé,hallaron. ¡Qué desgracias! Este pueblo tan indefenso está siempre espuesto a ser invadido; desde que lo fue el 4 de,"noviembre,","no hay momento de sosiego ya con temores, ya con noticias de que vienen. ¡Qué trastornos! Por un lado, quiero",-iembre,particular,38.027377,-3.099933
CODEA-3416,1809,XIX,Navarra,Pamplona,"36 mil reales el otro hasta 50 mil, y yo he revajado de 55700 que suman las tres partidas por","noviembre,","obra pía y alcaldía a 4500 de que revavados los 2 mil de casa me quedan 2500 para comer, vestir",-iembre,particular,42.812526,-1.6457745
CODEA-3596,1545,XVI,Cáceres,Cáceres,En cuatro días de,"noviembre,","I mil DXLV años ant'el señor bachiller Alonso Valverde, teniente en ella por el magnífico señor licenciado Bartolomé Martines, corregidor",-iembre,particular,39.4752765,-6.3724247
CODEA-3889,1869,XIX,Guadalajara,Guadalajara,muladares establecidos en los puntos estremos de esta población. 6.ª Las horas de limpieza diaria serán en los meses de,"noviembre,",diciembre y enero desde las siete de la mañana hasta las once de la misma; en los de febrero marzo,-iembre,municipal,40.632489,-3.1601699
CODEA-3908,1810,XIX,La Rioja,San Asensio,"sigue con mucha devilidad. Y contestando a la de V. fecha 15 de octubre, que la reciví el 3 de","noviembre,",devo decir que a pesar de las circunstancias presentes y los apuros que incesantemente están experimentando los pueblos por las,-iembre,particular,42.4975,-2.748889
CODEA-4015,1480,XV,Lugo,"Monasterio de San Miguel de Eiré, Pantón",por nós o por nuestros sucesosores lo oviere de recabdar e por servicios de veinte maravedís pagos por Sant de,"noviembre,",e por cada persona doze maravedís viejos. E avedes de ser servientes e obedientes a nós e a nuestros sucesores,-iembre,particular,42.5188,-7.6458
CODEA-4016,1483,XV,Lugo,"Monasterio de San Julián de Samos, Samos",después de vós sesenta e un maravedís de ocho en sueldo cada maravedí por el día de Sant Martín de,"noviembre,",los sesenta maravedís por el dicho casar e el un maravedí por la dicha cámara con su sobrado. E seredes,-iembre,particular,42.731944,-7.326111
CODEA-1392,1314,XIV,Zamora,Toro,E d'esta les mandé dar esta mi carta seellada con mio seello de plomo. Dada en Toro veinte días de,"Noviembre,",era de mill CCC e cincuenta e dos años yo <…> Joán <…> la fiz escrivir por mandado del rey,-iembre,cancilleresco,41.5274417,-5.3913374
CODEA-0849,1301,XIV,Huesca,s.l.,qui nós querremos o mandaremos los ditos dineros en cadaún año por la fiesta de Sant Andreu del mes de,noviembre;,e exament que provadades e paguedes todas messiones que en las ditas eglesias e abadías se conviene afer assí como,-iembre,eclesiástico,42.1401,-0.408898
CODEA-2237,1773,XVIII,Lugo,Monforte de Lemos,son la castaña y nabos de que en muchas partes de este reino se paga el diezmo de noviembre a,noviembre;,y el ser preciso en justicia y en conciencia hacer el prorrateo de frutos aunque estén arrendados por los años,-iembre,particular,42.5190217,-7.5158063
CODEA-3233,1830,XIX,Álava,Amurrio,Amurrio y octubre 25 de 1830. Contestada en 1.º de,noviembre:,se aga la escritura a don Juan Tomás Ordoño de la casa de Landero. Muy señora mía y de toda,-iembre,particular,43.052507,-3.000896
CODEA-0020,1450,XV,Palencia,Aguilar de Campoo,los cuales Nuestro Señor guarde e todos tiempos tenga en su guarda. De la mi villa de Aguilar XXV de,noviembre.,A lo que mande. Carta particular A mi señor primo don Diego Furtado de Mendoza.,-iembre,particular,42.7931905,-4.2622141
CODEA-0406,1301,XIV,La Rioja,Cañas,"Roy López fi de Lope Furtado; Garcí Sánchez, fi de Sancho López de Cardenas. Fecha en Cañas postremero día de",noviembre.,"Martín Martínez la fezo con otorgamiento de doña Teresa Ivañes la priora sobredicha, en era de mill e trezientos e",-iembre,eclesiástico,42.177157,-1.7552281
CODEA-0632,1287,XIII,La Rioja,s.l.,e con salidas merino dell abadessa doña Urraca López pora'l monesterio e pora'l convento de Cañas. VIIII días andados de,noviembre.,Era de mill CCCXXV años.,-iembre,eclesiástico,42.46577,-2.449995
CODEA-0938,1360,XIV,Navarra,s.l.,e fagan por vós en manera que esta nuestra comissión e mandamiento podades complecer. Data en Pamplona IX día de,noviembre.,"El tenient logar de rey la mandó. Testes: don Miguel Périz de Leoz cavallero, e don Joán de Alecuesa, alcalde.",-iembre,judicial,42.81721,-1.646767
