ID,Fecha,Siglo,Provincia,Población,Cont_anterior,Forma,Cont_posterior,Variante,Ámbito,Latitud,Longitud
CODEA-3888,1898,XIX,Guadalajara,Guadalajara,"presidente un pliego abierto que contenía su cédula personal número ocho clase décima, expedida en Marchamalo con fecha once de",septiembre,último y el resguardo de haber consignado en la depositaría municipal el depósito provisional exigido para tomar parte en la,-iembre,particular,40.632489,-3.1601699
CODEA-3888,1898,XIX,Guadalajara,Guadalajara,"su cédula personal de novena clase número doscientos noventa y dos, expedida en Cabanillas con fecha diez y nueve de",septiembre,"último y el resguardo de depósito provisional, licitando a la subasta por la cantidad de trescientas setenta pesetas con aceptación",-iembre,particular,40.632489,-3.1601699
CODEA-3888,1898,XIX,Guadalajara,Guadalajara,"otro pliego abierto que contenía su cédula personal número tres mil ciento ochenta y cinco clase octava, fecha once de",septiembre,"último y el resguardo de depósito provisional, licitando a esta subasta por la cantidad de trescientas ochenta pesetas con aceptación",-iembre,particular,40.632489,-3.1601699
CODEA-3904,1812,XIX,Córdoba,Córdoba,clamamos nos dé el de dilatar su importante vida muchos años. D'este su convento de Capuchinas de Córdova 21 de,septiembre,"de 1812. Excelentísimo señor besa la mano de vuestra excelencia su obligada sierva y afectísima hija en el Señor, sóror",-iembre,eclesiástico,37.8881751,-4.7793834
CODEA-3970,1810,XIX,Lérida,s.l.,de bautismos de la parroquia de Tremp (de la que son naturales todos mis progenitores) cuando en 7 del último,septiembre,entraron en ella es preciso hacerla por medio de la información de testigos que ofresco sobre los puntos siguientes: Que,-iembre,particular,41.61415,0.6257825
CODEA-3970,1810,XIX,Lérida,s.l.,de testigos que ofresco sobre los puntos siguientes: Que cuando los franceses invadieron la villa de Tremp en 7 de,septiembre,"del presente año quemaron los libros de bautismos y otros de la parroquia, como se justificará por ser verdad, público",-iembre,particular,41.61415,0.6257825
CODEA-3971,1810,XIX,Lérida,Tremp,y fama pública que los enemigos la segunda vez que invadieron a esta villa el siete del anterior mes de,septiembre,pegaron fuego al parage donde estaban escondidos los libros de la parroquia de la presente villa y que estos se,-iembre,particular,42.16668,0.89465
CODEA-3994,1818,XIX,Soria,Almazán,"En el lugar de Matamala aldea y juristición de la villa de Al mazán, a primeros de",septiembre,"de mil ochocientos diez y ocho ante mí el escribano y testigos que abajo se expresarán compareció Josefa Sarmentera, de",-iembre,particular,41.48592,-2.533437
CODEA-3994,1818,XIX,Soria,Almazán,en este pliego del sello tercero escrito de age na mano y rubricado de la que acostumbro a cinco de,septiembre,"de mil ochocientos diez y ocho. Enmendado “de” “y”, “q”; valga. Josef Antonio del Río.",-iembre,particular,41.48592,-2.533437
CODEA-0360,1314,XIV,Valladolid,s.l.,"Señero e Miguel, fijo de María Franca, éstos de Cabeçón, e don Salvador de Palazuelos. Fecha viernes primero día de","septiembre,","era de mill e trecientos e cinqu<enta> e dos años. E yo Joán Roíz el dicho escrivano, fiz d'esto dos",-iembre,eclesiástico,41.65295,-4.728388
CODEA-0586,1273,XIII,León,Astorga,e mandéi poner en ella mio seyello pendiente. Fecho fu esto en casa del deán sobredicto XXV días del mes,"septiembre,","E porque yo Joán Paiz notario sobredicto, xamado e rogado fuy presente a dar esta sentencia a rogo de los",-iembre,eclesiástico,42.4549303,-6.0532511
CODEA-0869,1333,XIV,Navarra,s.l.,a mí e a los mis sucessores qui serán por tiempo por la fiesta de Sant Miguel del mes de,"septiembre,",e la meatat de la dieçma de la dicha viña que dedes e trayades cada año leyalment e complidament al,-iembre,particular,42.81721,-1.646767
CODEA-1323,1579,XVI,Soria,Burgo de Osma,y testimonio verdadero en forma a todos los señores qu'el presente vieren cómo en onze días d'este presente mes de,"septiembre,","año de mil e quinientos y setenta e nueve años bi a Euxenio Fernández Abarca, corregidor de la ciudad de",-iembre,municipal,41.587565,-3.0668548
CODEA-1328,1591,XVI,Madrid,San Lorenzo de El Escorial,"holgaré d'ello cuanto lo entenderéis del dicho mi capellán a quien me remito. Dada en Sant Lorencio, a nueve de","septiembre,",MDXCI. Yo el Rey. Por mandado del Rey nuestro señor. Gabriel de Cayas.,-iembre,cancilleresco,40.5932386,-4.1475748
CODEA-1584,1598,XVI,Madrid,s.l.,Esta niña no va cristiana. Cristiánenla. Nació a nueve de,"septiembre,",1598.,-iembre,particular,40.41669,-3.700346
CODEA-1901,1778,XVIII,La Coruña,Pontedeume,a la citada testamentaria; porque las que se arrendaron en junio de 1771 las perciben los llebadores en agosto y,"septiembre,",la obligacion de paga de ellas es en junio y agosto del siguiente por mitad y por esta razón andan,-iembre,particular,43.4074479,-8.1699094
CODEA-1901,1778,XVIII,La Coruña,Pontedeume,continuación el orden para la cobranza que por lo regular la hacen los mayordomos que llaman de cebadas en el,"septiembre,",y suelen no fenecer la contribución los vasallos hasta diciembre que tienen proporción de hacer dinero de ganados y otras,-iembre,particular,43.4074479,-8.1699094
CODEA-2126,1777,XVIII,Sevilla,Sevilla,quien descargó de su conciencia. Añade a la declaración que hizo contra esta reo en 10 del mismo mes de,"septiembre,","folio 5 pero es de advertir, no resulta de esta sumaria dicha espontánea, que supone hizo con la fecha referida.",-iembre,judicial,37.3890924,-5.9844588
CODEA-2139,1570,XVI,Granada,Guadix,"hecha la publicación comunicó con su abogado sin que añadiesse cosa alguna. En vista de los antecedentes, día 20 de","septiembre,",el inquisidor Muñoz solo con poder del ordinario dijo: etcétera.,-iembre,judicial,37.3004,-3.134583
CODEA-2140,1729,XVIII,Cuenca,Cuenca,y una vez fue porque no fue la testigo a confesarse y porque no hacía la obediencia. Dice que por,"septiembre,","en ausencia del reo a una romería se confesó la testigo con el presidente y predicador de Roda, y ambos",-iembre,judicial,40.0703925,-2.1374161
CODEA-2340,1796,XVIII,Teruel,Teruel,6 de,"septiembre,",1796. Excelentísimo señor: Muy señor mío y de mi mayor estimación y respeto por el correo anterior recibí carta del,-iembre,particular,41.0513827,-0.1325616
CODEA-2342,1782,XVIII,Zaragoza,Marracos,"menos daño hasta la cabaneza en que recibirán merced. Nuestro Señor Dios guarde a vuestra excelencia muchos años. Marracos, y","septiembre,","a 24 de 1782. Excelentísimo señor E. V. que S. B. Josef Bercero, alcalde. De orden y mandamiento de los",-iembre,municipal,42.09059,-0.7760469
CODEA-2514,1693,XVII,Madrid,Madrid,años poco más o menos que la dicha doña Agustina estubo enferma tres o cuatro meses por los meses de,"septiembre,","otubre nobiembre y diziembre sin salir de su cassa, en la calle de los Preziados, en cassas de don Felipe",-iembre,judicial,40.4167754,-3.7037901
CODEA-2800,1713,XVIII,Madrid,Madrid,"un mandria solo ay de todas bezindades en cassa. Dios nos asista y te guarde querida, muchos años. Madrid, y","septiembre,","12 de 1713. Tu hermana y amiga fina, Elbira. Querida hermana y señora. Juan marchó el domingo, Dios le aga",-iembre,particular,40.4167754,-3.7037901
CODEA-2800,1713,XVIII,Madrid,Madrid,"ocho que no estaba en mi casa. Dios le aga bueno y te guarde hermano mío, muchos años. Madrid, y","septiembre,",12 de 1713. Embíote la carta de Sancho en que da a entender es otro. Besa tu mano tu hermana,-iembre,particular,40.4167754,-3.7037901
CODEA-2992,1897,XIX,Almería,Almería,"en hacer si la enmienda de cuanto quiera vuestra merced ser servidos reunirse conmigo a mi aldea. Almería, 19 de","septiembre,",1897. Antonio Rueda Córdoba.,-iembre,municipal,36.84016,-2.467922
CODEA-2997,1898,XIX,Almería,Almería,estudios de segunda enseñanza suplica a Vuestra Señoría se sirva admitirle al examen de ingreso de la presente convocatoria de,"septiembre,",previo el pago de los derechos correspondientes. Gracia que espera merecer de Vuestra Señoría cuya vida guarde Dios muchos años.,-iembre,municipal,36.84016,-2.467922
CODEA-3162,1756,XVIII,Cuenca,Cuenca,"que este. Francisca García de 18 años, y mujer de el citado alcaide, en la declaración hecha en 26 de","septiembre,",contestando formal las proposiciones que dijo el reo en la expresada ocasión dijo aver oído al reo que se cagaba,-iembre,judicial,40.0703925,-2.1374161
CODEA-3162,1756,XVIII,Cuenca,Cuenca,el marido de la declarante con la Inquisición respondió más que lo llevasen a ella. Que el domingo 17 de,"septiembre,","a cosa de las 9 de la mañana avisó la declarante, como es costumbre, que no metiessen ruido, pues se",-iembre,judicial,40.0703925,-2.1374161
CODEA-3346,1813,XIX,Málaga,Antequera,Antequera y,"septiembre,","9 de 1813. Mi más estimado amigo acabo de resivir la de usted muy atrasada, la que me remiten de",-iembre,particular,37.018365,-4.559665
CODEA-3457,1830,XIX,Ávila,Ávila,Ávila y,"septiembre,",25 de 1830. Muy ilustre señor conde de Luque. Muy señor mío y de mi mayor veneración: Contesto a la,-iembre,particular,40.656685,-4.6812086
CODEA-3490,1716,XVIII,Sevilla,Sevilla,Sebilla y,"septiembre,","29 de 1716. Don Francisco Ignacio Pérez de Meñada. Muy señor mío, reciví la de V.S. y con ella la",-iembre,particular,37.3890924,-5.9844588
CODEA-3490,1716,XVIII,Sevilla,Sevilla,"quedo muy a la ovediencia de V.S. con todo afecto cuya vida guarde Dios muchos años como deseo. Sevilla, y","septiembre,","29 de 1716. Besa la mano de V.S. su mayor servidor, Francisco Ignacio Pérez de Meñaca y de la Hoz.",-iembre,particular,37.3890924,-5.9844588
CODEA-3600,1556,XVI,Cáceres,Guadalupe,reales. Fray Lucas de Yepes. Inventario de las cosas que ay en el horno. En XXV días del mes de,"septiembre,","año de I mil DLVI por mandado de nuestro muy reverendo padre fray Jerónimo de Carmona, se hizo este inventario",-iembre,eclesiástico,39.4513206,-5.3272431
CODEA-3626,1603,XVII,Cáceres,Jarandilla de la Vera,"y se entregaron al bachiller Joán de Peinado mayordomo. En la villa de Jarandilla, a treinta días del mes de","septiembre,","año del Señor de mil y seiscientos y tres años en presencia e por ante mí, Alonso de la Cruz,",-iembre,particular,40.126944,-5.658333
CODEA-3722,1800,XIX,Alicante,Alicante,cuatro mil y trecientos reales vellón empesando hacer el rintreguo de el dinero antecipado en la encendida del mes de,"septiembre,",y en cada una encendida reintreguarré trecientos y sesenta reales de vellón. 6.ª condición: que una ves que se haya,-iembre,particular,38.3459963,-0.4906855
CODEA-3906,1809,XIX,La Rioja,San Asensio,pongo en manos de Vmd. copia legalizada de todas las que tengo escritas con fechas 7 16 y 28 de,"septiembre,",8 y 3 de noviembre con inclusión de el testimonio que la subsigue que se me proveyó a el tiempo,-iembre,particular,42.4975,-2.748889
CODEA-3945,1495,XV,Lugo,Quiroga,y de paja todo esto pagado por medida derecha de tierra de Quiroga por el mes de agosto o de,"septiembre,",todo esto por diezmo y quiñón y por derechura veinte y cinco maravedís viejos cada un año por la fiesta,-iembre,particular,42.475833,-7.271667
CODEA-4003,1642,XVII,Tarragona,Ulldecona,fuere de su mayor servisio de vuestra excelencia. Dios guarde a vuestra excelencia con los aumentos que desseo. Uldecona y,"septiembre,",a 14 de 1642. Don Dionisio Carroz de Vilaragut.,-iembre,particular,40.59805,0.44816
CODEA-1068,1654,XVII,Salamanca,Salamanca,"Señor le dé felises Pascuas los años que estas umildes súbditas de vuestra alteza le suplicamos. Santi Spiritus Salamanca, de",septiembre.,"6 de 654. Doña Isabel Maldonado Mesía, comendadora.",-iembre,eclesiástico,40.9701039,-5.6635397
CODEA-1910,1673,XVII,Cáceres,Trujillo,"de su Magestad lo firmé en este libro de acuerdos. En Truxillo, en veinte y nueve días del mes de",septiembre.,Año de mil y seiscientos y setenta y tres. | Juan <…> | Pedro Serrano.,-iembre,judicial,39.4595379,-5.8802356
CODEA-3819,1810,XIX,Toledo,Toledo,"su caridad y damos gracias y rogaremos al Señor nos le guarde muchos años. María Paz, presidenta. Oy 1º de",septiembre.,NA,-iembre,particular,39.8628316,-4.0273231
CODEA-0017,1466,XV,Madrid,Madrid,a vista de los fieles. Que fasta sant Joán vendan carneros cojudos e desde sant Joán fasta sant Miguel de,setiembre,que den carneros castrados; e si carneros cojudos vendieren que los den al precio de la oveja o vaca; e,-iembre,municipal,40.4167754,-3.7037901
CODEA-0017,1466,XV,Madrid,Madrid,borregos e carneros cojudos al precio de onze maravedís el arrelde. An de dar desde oy fasta sant Miguel de,setiembre,carnero abasto e desde sant Miguel a Carrastollendas cada día doze carneros. Otra persona non á de vender carne a,-iembre,municipal,40.4167754,-3.7037901
CODEA-0071,1288,XIII,Álava,Vitoria,pujesas que se non abatan nin se labren éstas nin otra nenguna en toda nuestra vida del postremo día de,setiembre,"en adelantre este primero que viene nin se assinen, nin se trabuquen, nin se fundan, e que vala cada una",-iembre,cancilleresco,42.8591656,-2.6817918
CODEA-0090,1301,XIV,Ávila,Ávila,de dineros o de otra cosa que lo vala. E que vos los demos el día de Sant Miguel de,setiembre,"este primero que viene e si por este plazo non vos los diéremos que vos los demos doblados. E vós,",-iembre,particular,40.656685,-4.6812086
CODEA-0091,1301,XIV,Ávila,Ávila,o de otra cosa que lo vala. E que vos demos estos maravedís dichos el día de sant Miguel de,setiembre,este primero que viene e si por este plazo dicho non vos los diéremos que vos los demos doblados. E,-iembre,particular,40.656685,-4.6812086
CODEA-0092,1301,XIV,Ávila,Ávila,de dineros o de otra cosa que lo vala. E que vos los demos el día de sant Miguel de,setiembre,"este primero que viene e si por este plazo non vos los diéremos que vos los demos doblados. E vós,",-iembre,particular,40.656685,-4.6812086
CODEA-0093,1301,XIV,Ávila,Ávila,o de otra cosa que lo vala. E que vos demos estos maravedís dichos el día de sant Miguel de,setiembre,este primero que viene e si por este plazo dicho non vos los diéremos que vos los demos doblados. E,-iembre,particular,40.656685,-4.6812086
CODEA-0143,1549,XVI,Guadalajara,Guadalajara,"testigos deyuso escritos que fue fecha e otorgada en la dicha cibdad de Guadalajara, a quinze días del mes de",setiembre,de mil y quinientos y cuarenta y nueve años. Testigos: Diego Roxo y Marcos de Aguilar e Julio de Razine,-iembre,judicial,40.632489,-3.1601699
CODEA-0184,1634,XVII,Guadalajara,Guadalajara,"lo hobiere de haber cuatrocientos reales de bellón, puestos en esta ciudad para veinte y cinco días del mes de",setiembre,del año que viene de seiscientos y cuarenta y cuatro; los cuales son y confesamos dever por otros tantos que,-iembre,judicial,40.632489,-3.1601699
CODEA-0271,1481,XV,Valladolid,Medina del Campo,nin se piden nin llieven de las que fueren dadas e puestas e reduzidas desde mediado el dicho mes de,setiembre,del dicho año de sesenta e cuatro a esta parte; e aunque sean impuestas por cartas e previllejos del dicho,-iembre,cancilleresco,41.3081627,-4.9154766
CODEA-0293,1555,XVI,Valladolid,Valladolid,merced y de diez mil maravedís para mi cámara. Dada en Valladolid a diez y ocho días del mes de,setiembre,de mil e quinientos e cincuenta e cinco años. Va sobreraído ó diz “el ayuntamiento” y emendado ó diz “losco”,-iembre,cancilleresco,41.6294336,-4.2616986
CODEA-0312,1368,XIV,Toledo,Toledo,Santa María de Guadalupe; e que comience la dicha feria diez días antes de la fiesta de Santa María de,setiembre,e que dure la dicha feria fasta diez días después de la dicha fiesta. E mandamos que todos aquellos que,-iembre,cancilleresco,39.8628316,-4.0273231
CODEA-0315,1497,XV,Palencia,"Santa María de Aguilar de Campoo, Aguilar de Campoo",vós paguedes <…> de tengo puesto e pagado en el dicho nuestro monasterio fasta el día de sant Miguel de,setiembre,"en cadaún año para siempre jamás e pagar en la carral, e cabritos, e gallinas, e dos maravedís de humazgo,",-iembre,particular,42.795889,-4.271836
CODEA-0326,1501,XVI,Palencia,Aguilar de Campoo,harto para la chiminea del convento donde se calientan los dichos religiosos desd'el día de sant Miguel del mes de,setiembre,hasta el día de Pascua de flores; otrosí son obligados los dichos señores abades de dar al dicho convento de,-iembre,eclesiástico,42.7931905,-4.2622141
CODEA-0350,1569,XVI,Valladolid,Valbuena de Duero,se libró nuestra carta executoria a la parte del dicho monasterio dirixida a vós las dichas justicias a cuatro de,setiembre,del año pasado de mil y quinientos y sesenta y ocho años. Y después Bernardino Gonçález en nombre de el,-iembre,cancilleresco,41.6425,-4.291111
CODEA-0432,1414,XV,Valladolid,"Monasterio de Santa Clara, Tordesillas",tenedes sembrada la dicha heredat avédesnos a fazer la primera paga del dicho pan por día de Santa María de,setiembre,primero que vien e así de cada año. E yo el dicho Domingo Pascoal así recibo de vós ela dicha,-iembre,eclesiástico,41.499892,-4.997241
CODEA-0460,1500,XVI,León,Vega de Espinareda,por ello de cadaún año a nós o a dicho nuestro monasterio por día de Santa María del mes de,setiembre,cuatro moyos de centeno en paz e en salvo en el dicho vale de Fornela por la capela que se,-iembre,eclesiástico,42.7215806,-6.656295
CODEA-0468,1464,XV,León,Astorga,"dichas tres cargas e media de pan meatad trigo e meatad centeno, e par de gallinas d'esta Santa María de",setiembre,primera que viene d'este año de la fecha d'esta carta en un año que será en el año del Señor,-iembre,eclesiástico,42.4549303,-6.0532511
CODEA-0468,1464,XV,León,Astorga,sesenta e cinco años e así dende en adelante en cadaún año por el dicho día de Santa María de,setiembre,perpetuamente para siempre jamás so pena del doblo vós e vuestros herederos e subcesores en lo sobredicho al dicho fuero,-iembre,eclesiástico,42.4549303,-6.0532511
CODEA-0468,1464,XV,León,Astorga,ello den nin prometan a dar pagando vós el dicho pan e gallinas por el día de Santa María de,setiembre,segund dicho es. E yo el dicho Gonçalo Benéitez estando presente por mí e en nombre de la dicha Catalina,-iembre,eclesiástico,42.4549303,-6.0532511
CODEA-0468,1464,XV,León,Astorga,dicha medida nueva e par de buenas gallinas de fuero cada año por el dicho día de Santa María de,setiembre,"por siempre jamás segund e en la manera que dicha es. E que si oviéremos de vender lo susodicho yo,",-iembre,eclesiástico,42.4549303,-6.0532511
CODEA-0494,1256,XIII,Segovia,Segovia,con mio seello de plomo. Fecha la carta en Segovia por mandado del rey XIII días andados del mes de,setiembre,en era de mill e dozientos e novaenta e cuatro años. E yo sobredicho rey don Alfonso regnant en uno,-iembre,cancilleresco,40.9429032,-4.1088068
CODEA-0538,1273,XIII,Toledo,Toledo,tres tercios del año; el primer plazo es el postrimer día de mayo e el otro plazo postrimer día de,setiembre,e el tercero plazo por Sant Sabastián. Este arrendamiento comiença por Sant Sabastián de era de doze. E si por,-iembre,eclesiástico,39.8628316,-4.0273231
CODEA-0546,1279,XIII,Segovia,San Facundo,"de Laguna. Esta carta fue fecha en casa de Ferrand Juañes el sobredicho a Sant Fagund sábado, XXX días de",setiembre,"en era de mill e trezientos e dizessiete años. Yo Gonçalo Juañes escrivano público, la escreví e fiz este mi",-iembre,eclesiástico,43.1643966,-4.7129981
CODEA-0634,1384,XIV,Cantabria,Monasterio de Santo Toribio de Liébana,años primeros siguientes que dedes en renta al dicho monesterio en cada año por la fiesta de Sant Miguel de,setiembre,un carnero vivo que se á de dar e de tomar e de los dichos ocho años en delant que,-iembre,eclesiástico,43.150333,-4.654339
CODEA-0655,1410,XV,Teruel,Rubielos de Mora,por tiempo será puesto por los ditos clérigos en cadaún año en el día de Sant Miguel del mes de,setiembre,por todos tiempos pora fazer el dito aniversario e que vós e los vuestros fagades a nós ditos clérigos e,-iembre,eclesiástico,40.1901266,-0.6541841
CODEA-0657,1412,XV,Teruel,Rubielos de Mora,en cadaún año diez soldos jaquetanos pagaderos la primera paga el día e fiesta de Sant Miguel del mes de,setiembre,primero que viene e aprés d'allí adelant de año en año en el dito día por todo el tiempo de,-iembre,eclesiástico,40.1901266,-0.6541841
CODEA-0665,1262,XIII,La Rioja,s.l.,más firme e en testimonia d'esto pongo ý mio seyello. Fecha la carta sábado XVI días andados del mes de,setiembre,en era de mil e trezientos años.,-iembre,eclesiástico,42.46577,-2.449995
CODEA-0729,1500,XVI,Cantabria,Monasterio de Santo Toribio de Liébana,mejor que agora corre puesto e pagado en el dicho logar de Roscales por el día de Santa María de,setiembre,en cadaún año para siempre jamás sin peligro e decuento alguno. E començar se á a pagar la primera paga,-iembre,eclesiástico,43.150333,-4.654339
CODEA-0749,1519,XVI,Zaragoza,Peñaflor,a los jurados que son o por tiempo serán del dicho lugar el día e fiesta de Sant Miguel de,setiembre,o un mes aprés. E será la primera paga e solución el día e fiesta de Sant Miguel de setiembre,-iembre,eclesiástico,41.7610053,-0.7966751
CODEA-0749,1519,XVI,Zaragoza,Peñaflor,setiembre o un mes aprés. E será la primera paga e solución el día e fiesta de Sant Miguel de,setiembre,primero venidor del año presente e infraescrito de mil quinientos y dizinuebe e assí de allí adelante en cadaún año,-iembre,eclesiástico,41.7610053,-0.7966751
CODEA-0758,1595,XVI,Sevilla,s.l.,"y es muy grande pues es negocio tan piadoso. Guarde Dios a vuestra merced. D'esta casa, oy martes, 12 de",setiembre,de 600 años. | El licenciado Juan de Aponte.,-iembre,particular,37.38264,-5.996295
CODEA-0765,1375,XIV,Teruel,Rubielos de Mora,vicario e clérigos que somos o por tiempo serán en el día e fiesta de Sant Miguel del mes de,setiembre,"de año en año. E asín el dito troz de tierra ayades vós e los vuestros tener e posedir, e",-iembre,eclesiástico,40.1901266,-0.6541841
CODEA-0768,1379,XIV,Teruel,Rubielos de Mora,seis soldos dos dineros jaqueses pagaderos en cadaún año en el día e fiesta de Sant Miguel del mes de,setiembre,ad in perpetum; al cual dito aniversario e sens seyer seguro yo dó e subjugo amos los ditos dos huertos,-iembre,particular,40.1901266,-0.6541841
CODEA-0769,1381,XIV,Teruel,Rubielos de Mora,los ditos huertos fazen nuev soldos jacetanos pagaderos en el día e fiesta de Sant Miguel Ángel del mes de,setiembre,en cada un año; los cuales ditos huertos con la dicha carga la dita Domeña relexó a nós segunt consta,-iembre,eclesiástico,40.1901266,-0.6541841
CODEA-0769,1381,XIV,Teruel,Rubielos de Mora,millorar e en ninguna cosa non peyorar e prometo pagar en cadaún año en el día de San Miguel de,setiembre,los ditos IX soldos jacetanos de ensens segunt las condiciones e maneras por vós desús ditas e declaradas; e por,-iembre,eclesiástico,40.1901266,-0.6541841
CODEA-0770,1382,XIV,Teruel,Rubielos de Mora,por los clérigos de la dita eglesia cojan los adniversarios en el día de Sant Miguel Ángell del mes de,setiembre,primo vinient en un año e asín de año en año troa la fin del mundo. E que vós e,-iembre,eclesiástico,40.1901266,-0.6541841
CODEA-0773,1385,XIV,Teruel,Rubielos de Mora,año e por siempre pagaderos por mí e los míos en el dicho día de Sant Miguel del mes de,setiembre,"pora'l dicho aniversario de la dicha Elvira casera del dicho Domingo Pérez, vicario que fue de la dicha eglesia, e",-iembre,eclesiástico,40.1901266,-0.6541841
CODEA-0792,1417,XV,Teruel,Rubielos de Mora,de fazer vint soldos jaqueses en cadaún año perdurablement en el día e fiesta de Sant Miguel del mes de,setiembre,sensales anuales e perpetuales con loísmo e fadiga e con todo otro pleno drechio enfitéotico de recebir aquellos segunt fuero,-iembre,eclesiástico,40.1901266,-0.6541841
CODEA-0924,1485,XV,Madrid,Alcalá de Henares,esta dicha villa e su común los dichos veinte mil maravedís. E dádgelos e pagádgelos en fin del mes de,setiembre,primero que verná d'este dicho año que se cumplirá el segundo tercio del dicho arrendamiento. E tomad en vós la,-iembre,municipal,40.4819791,-3.3635421
CODEA-0940,1359,XIV,Navarra,Lumbier,coal casa nós o nuestros sucessores terremos por bien por el día e fiesta de Sant Miguel del mes de,setiembre,"por todos tiempos. Otrosí nós los sobredichos abat monges e conviento queremos, consentimos e nos plaze que vós los sobredichos",-iembre,eclesiástico,42.650772,-1.295129
CODEA-0940,1359,XIV,Navarra,Lumbier,o redamiento pora en cadaún año pora siempre jamás por el día e fiesta de Sant Miguel del mes de,setiembre,enna dicha villa de Ongoç en coalquiere casa que vós e los vuestros sucessores terredes por bien a vós el,-iembre,eclesiástico,42.650772,-1.295129
CODEA-0943,1500,XVI,Huesca,Huesca,la cual viña es franca exceptado de un sueldo de trehúdo a la seu de Huesca por el mes de,setiembre,"pagadero. Querient e expresament consintient yo dito Martín de Samper donant, que vós ditos prior, fraires e convento, e los",-iembre,eclesiástico,42.131845,-0.4078058
CODEA-0965,1296,XIII,Navarra,Sangüesa,dita pieça viña e que la esfruitedes vós o vuestro mandamiento quitament d'esta fiesta de Sant Miguel del mes de,setiembre,primero venient ata quinze años continuos e complidos quinze fruitos cullidos; e a cabo de los quinze años continuos e,-iembre,eclesiástico,42.5744349,-1.283085
CODEA-0968,1329,XIV,Navarra,Fitero,"don Ferrando e Sancho Carro e García, fijo del dicho don Sancho Cervero, vezinos de Cervera. Fecha XIX días de",setiembre,"era de mil e CCC e sessanta e siete años. E yo Francés Pérez escrivano público del concejo de Cervera,",-iembre,eclesiástico,42.0594523,-1.8598812
